### ISSUE TITLE
rcid option in ocsp command fails to report serial number

### ISSUE THREAD

**Issue by DrClaudio73** [openssl/openssl#31070]
When specifying the -rcid option no error is reportd in the command output (shell). Nevertheless, the serial number is always reported as 0x00.
This prevents the ocsp client to extract certificate status response data.

Example:
(Responder)
$ openssl ocsp -port 9051 -index  ./root-ca-xxxxx/db/index -CA ./root-ca-xxxxx/root-ca-xxxxx-crt.pem -rsigner ./root-ca-xxxxx/ocsp/root-ca-xxxxx-ocsp-crt.pem -rkey ./root-ca-xxxxx/ocsp/private/root-ca-xxxxx-ocsp.key -resp_key_id -rmd sha1 -nmin 60  -timeout 60 -CAfile ./root-ca-yyyyy/root-ca-yyyyy-crt.pem -ignore_err  -text > ../tmp/OCSP_log_root-ca-yyyyy.log -passin env:password -rcid md5 

ocsp: waiting for OCSP client connections...

(Client)
$ openssl ocsp -issuer ./root-ca-xxxxx//root-ca-xxxxx/-crt.pem -md5 -cert ./root-ca-xxxxx/certs/2C9E7222082E3F2AFE633E0C5D1C32A8.pem -url http://127.0.0.1:9051 -nonce -passin password -CAfile ./root-ca-xxxxx//root-ca-xxxxx-crt.pem
Response verify OK
./root-ca-xxxxx/certs/2C9E7222082E3F2AFE633E0C5D1C32A8.pem: ERROR: No Status found.

In wireshark we have this trace:

Frame 94: Packet, 333 bytes on wire (2664 bits), 333 bytes captured (2664 bits) on interface lo, id 0
Ethernet II, Src: 00:00:00_00:00:00 (00:00:00:00:00:00), Dst: 00:00:00_00:00:00 (00:00:00:00:00:00)
Internet Protocol Version 4, Src: 127.0.0.1, Dst: 127.0.0.1
Transmission Control Protocol, Src Port: 9051, Dst Port: 52588, Seq: 4097, Ack: 213, Len: 267
[2 Reassembled TCP Segments (4363 bytes): #92(4096), #94(267)]
Hypertext Transfer Protocol
Online Certificate Status Protocol
    responseStatus: successful (0)
    responseBytes
        ResponseType Id: 1.3.6.1.5.5.7.48.1.1 (id-pkix-ocsp-basic)
        BasicOCSPResponse
            tbsResponseData
                responderID: byKey (2)
                    byKey: 74b717d56f56ebf3e29cf4d901eed2942f14e565
                producedAt: May  4, 2026 02:43:50.000000000 EDT
                responses: 1 item
                    SingleResponse
                        certID
                            hashAlgorithm (md5)
                                Algorithm Id: 1.2.840.113549.2.5 (md5)
                            issuerNameHash: c112b5534ab8f455831f181463d3fea0
                            issuerKeyHash: bdb30714dfafb4fe70f8d788b61a7772
                            serialNumber: 0x00   <---- THIS IS THE ISSUE!!!
                        certStatus: good (0)
                            good
                        thisUpdate: May  4, 2026 02:43:50.000000000 EDT
                        nextUpdate: May  4, 2026 03:43:50.000000000 EDT
                responseExtensions: 1 item
            signatureAlgorithm (sha1WithRSAEncryption)
                Algorithm Id: 1.2.840.113549.1.1.5 (sha1WithRSAEncryption)
            Padding: 0
            signature […]: d817d14cead8cb1e16ccd1bec1793f83b500fb601e77c5f9b1fb736ffbf894ff5c3eb5ff421f80c848c4716dccde97792c7dca38bcafa885efe06084ee4a155cc306869315a8dd4ba774bb33821bc8f7d92a6e4af36de6f39949c1940bda80c77a82a6dfad5ae03b94069540b4be4c
            certs: 2 items

I have tried on different systems (Kali VMs different version of openssl)  system installed:
openssl version -a
OpenSSL 3.5.5 27 Jan 2026 (Library: OpenSSL 3.5.5 27 Jan 2026)

openssl version -a
OpenSSL 3.5.3 16 Sep 2025 (Library: OpenSSL 3.5.3 16 Sep 2025)

When not using the -rcid option the responders replies correctly, identifying the certficate (serialNumber field) using the same hash as in the OCSP request.

Example:

(Responder)
$ openssl ocsp -port 9051 -index  ./root-ca-xxxxx/db/index -CA ./root-ca-xxxxx/root-ca-xxxxx-crt.pem -rsigner ./root-ca-xxxxx/ocsp/root-ca-xxxxx-ocsp-crt.pem -rkey ./root-ca-xxxxx/ocsp/private/root-ca-xxxxx-ocsp.key -resp_key_id -rmd sha1 -nmin 60  -timeout 60 -CAfile ./root-ca-yyyyy/root-ca-yyyyy-crt.pem -ignore_err  -text > ../tmp/OCSP_log_root-ca-yyyyy.log -passin env:password

ocsp: waiting for OCSP client connections...

(Client)
$ openssl ocsp -issuer ./root-ca-xxxxx//root-ca-xxxxx/-crt.pem -md5 -cert ./root-ca-xxxxx/certs/2C9E7222082E3F2AFE633E0C5D1C32A8.pem -url http://127.0.0.1:9051 -nonce -passin password -CAfile ./root-ca-xxxxx//root-ca-xxxxx-crt.pem

Response verify OK
./root-ca-xxxxx/certs/2C9E7222082E3F2AFE633E0C5D1C32A8.pem: good
        This Update: May  4 07:05:47 2026 GMT
        Next Update: May  4 08:05:47 2026 GMT

In wireshark:

Frame 188: Packet, 181 bytes on wire (1448 bits), 181 bytes captured (1448 bits) on interface lo, id 0
Ethernet II, Src: 00:00:00_00:00:00 (00:00:00:00:00:00), Dst: 00:00:00_00:00:00 (00:00:00:00:00:00)
Internet Protocol Version 4, Src: 127.0.0.1, Dst: 127.0.0.1
Transmission Control Protocol, Src Port: 34612, Dst Port: 9051, Seq: 98, Ack: 1, Len: 115
[2 Reassembled TCP Segments (212 bytes): #186(97), #188(115)]
Hypertext Transfer Protocol
Online Certificate Status Protocol
    tbsRequest
        requestList: 1 item
            Request
                reqCert
                    hashAlgorithm (md5)
                        Algorithm Id: 1.2.840.113549.2.5 (md5)
                    issuerNameHash: c112b5534ab8f455831f181463d3fea0
                    issuerKeyHash: bdb30714dfafb4fe70f8d788b61a7772
                    serialNumber: 0x2c9e7222082e3f2afe633e0c5d1c32a8  <-- CORRECT VALUE OF SEIRAL NUMBER
        requestExtensions: 1 item

Thank you for your attention.
Regards

**Comment by DrClaudio73** [comment]
You can modify the rmd and try different combinations of rcid/rmd: in any case when using -rcid option the serialNumber is always 0x00. 
Only removing the -rcid option it works.

Thank you

**Comment by idrassi** [comment]
I can reproduce this. The issue looks valid.

The problem appears to be in `apps/ocsp.c` in the `-rcid` path. When `-rcid` is set, `make_ocsp_response` rebuilds the response CertID with:

```c
cid_resp_md = OCSP_cert_to_id(resp_md, NULL, ca_cert);
```

With subject == NULL, OCSP_cert_to_id uses the issuer certificate for the issuer name and key hashes but has no subject certificate, so it passes serial = NULL to `OCSP_cert_id_new`. The resulting OCSP_CERTID keeps the default ASN.1 INTEGER value, which is why the signed response contains serialNumber: 00.

The lookup itself is still done using the serial from the original request, so the responder signs a status for the requested certificate but puts that status under a response CertID with serial 00. Clients then correctly fail to match the response to the request and report "No Status found".

The fix is to rebuild the response CertID with the original request serial, e.g. use `OCSP_cert_id_new(resp_md, X509_get_subject_name(ca_cert), X509_get0_pubkey_bitstr(ca_cert), serial)` after extracting serial from the request cid, and handle allocation failure. A regression test can be added to check that `openssl ocsp ... -rcid sha256` preserves the original serial number in the response and that the client can match the status.

I will work on a PR for this.

From what I see, this dates back to the original -rcid implementation, so it is not specific to 3.5.x.

**Comment by idrassi** [comment]
I have opened PR #31081 to address this

**Comment by DrClaudio73** [comment]
Thank you.
