### DISCUSSION TITLE
Openssl v3.0.13 delay sends Client Hello by more than 10 seconds

### DISCUSSION THREAD

**Discussion by hipadia** [openssl/openssl#27018] [Q&A]
On Windows, we are using OpenSSL version 3.0.13. We have noticed that intermittently, the Client Hello message takes more than 10 seconds to send (see no. 6 below). Previously, we were using OpenSSL 1.1.1.19 and did not encounter this issue. Due to the delayed Client Hello sent by the client to the server, the server assumes there is no activity and a 10-second timeout gets triggered, resulting in the server closing the connection.

What could have been causing this 12 second delay?
  
Below is a packet capture where we can see the behavior where in these logs, we have 12-second delay for the Client Hello:

1. 123832    2025-01-29 11:46:24.915709    clientIP    serverIP    TCP    66    51790 ? 443 [SYN, ECE, CWR] Seq=0 Win=64240 Len=0 MSS=1460 WS=256 SACK_PERM
2. 123833    2025-01-29 11:46:24.916560    serverIP    clientIP    TCP    66    443 ? 51790 [SYN, ACK] Seq=0 Ack=1 Win=65535 Len=0 MSS=1412 SACK_PERM WS=256
3. 123834    2025-01-29 11:46:24.916677    clientIP    serverIP    TCP    54    51790 ? 443 [ACK] Seq=1 Ack=1 Win=4194816 Len=0
4. 137077    2025-01-29 11:46:34.993559    serverIP    clientIP    TCP    60    443 ? 51790 [FIN, ACK] Seq=1 Ack=1 Win=269824 Len=0
5. 137078    2025-01-29 11:46:34.993626    clientIP    serverIP    TCP    54    51790 ? 443 [ACK] Seq=1 Ack=2 Win=4194816 Len=0
6. 148201    2025-01-29 11:46:36.395143    clientIP    serverIP    TLSv1.2    571    Client Hello (SNI=oauth2.googleapis.com)
7. 148206    2025-01-29 11:46:36.396087    serverIP    clientIP    TCP    60    443 ? 51790 [RST] Seq=2 Win=0 Len=0

The etl file shows TCP 3-way handshake completed:
2086916[54]1533C.27698::01/29/25-11:46:24.9153705 [Windows-TCPIP/Diagnostic] TCP: endpoint 0xFFFF98811B1F4C70 (sockaddr=0.0.0.0:51790) bound. 0xFFFF98811B1F4C70, 16
2086917 [54]1533C.27698::01/29/25-11:46:24.9153721 [Windows-Winsock Network Event/Operational ] bind: 1: Process 0xFFFF908CEAA36080, Endpoint 0xFFFF98814B2581C0, Address 0.0.0.0:51790, Seq 7022, Status STATUS_SUCCESS 1
2087435 [54]1533C.27698::01/29/25-11:46:24.9155171 [Windows-TCPIP/Diagnostic] TCP: Tcb 0xFFFF98819758E1A0 (local=clientIP:51790 remote=serverIP:443) requested to connect. 0xFFFF98819758E1A0, 16, clientIP:51790, 16
2088128 [54]1533C.27698::01/29/25-11:46:24.9155820 [Windows-TCPIP/Diagnostic] TCP: connection 0xFFFF98819758E1A0 (local=clientIP:51790 remote=serverIP:443) connect proceeding. 16, clientIP:51790, 16, serverIP:443, STATUS_SUCCESS, 0
2088217 [0]19230.53090::01/29/25-11:46:24.9164910 [Windows-TCPIP/Diagnostic] TCP: connection 0xFFFF98819758E1A0 (local=clientIP:51790 remote=serverIP:443) connect completed. PID = 86844 ProcessSeqNum = 2814749768100376. 16, clientIP:51790, 16, serverIP:443

This was at 11:46:24 as seen in packet capture above, and it's not until 11:46:36 when Winsock receives the data from the openssl so it can send it through the wire.

2371108 [42]1533C.27698::01/29/25-11:46:36.3949786 [Windows-Winsock Network Event/Operational ] send: 0: Process 0xFFFF908CEAA36080, Endpoint 0xFFFF98814B2581C0, Buffer Count 1, Buffer 0xFFFF9881101EB6C0, Length 517, Seq 3047, Status STATUS_SUCCESS

 ++ This was at 11:46:24 as seen in packet capture above, and it's not until 11:46:36 when Winsock receives the data from the application so it can send it through the wire.

**Comment by nhorman** [comment]
My first guess (based only on the fact that there is a latency between the tcp connection establishment and the start of an SSL handshake) is that the client application in question here is separately creating the socket, connecting the socket, and assigning the socket to to the SSL object.  i.e. the application is likely doing the following things:

1) calling BIO_socket to create the TCP socket
2) calling BIO_connect to establish the TCP connection
3) creating a socket bio with BIO_new(BIO_s_socket())
4) creating an SSL object with SSL_new
5) Assigning the socket from step (1) to the SSL in step (4) with SSL_set_bio()
6) starting the SSL handshake with a call to SSL_connect()

I would hypothesize that there is some application latency between steps 1-5 and step 6.  I would suggest that you run the client application under a debugger, set breakpoints in the call to SSL_new and the call to SSL_connect. If you see a simmilar 10 second latency between hitting those two breakpoints, you would have confirmation of that latency, and then you could start tracking down what the application is doing between those points in time.
