### DISCUSSION TITLE
SSL error: Last octet invalid

### DISCUSSION THREAD

**Discussion by ramongalate** [openssl/openssl#25196] [Q&A] [answered]
I was recently tasked with updating the company's Apache HTTPd gateway where I work to use Openssl 3 from previous 1.0.x and enable TLS1.3 with the apache mod_ssl configuration.

It is based off the:
https://github.com/apache/httpd 
using version 2.4.62
and 
openssl | src, aarch64, x86_64 | 3.0.8-1.amzn2023.0.12 from the amazon linux 2023 packages

It does an overall verification of OCSP checking and certificate verification before proxying the traffic down the stack. 

Currently, the solution works locally (on my machine/docker 😬), but fails after deployment with an error that is triggered in the openssl project regarding the certificate having an invalid last octet during the ssl handshake after a successful ocsp check:

```bash
AH02008: SSL library error 1 in handshake

SSL Library Error: error:02000086:rsa routines::last octet invalid

SSL Library Error: error:1C880004:Provider routines::RSA lib

SSL Library Error: error:0A00007B:SSL routines::bad signature
```
which comes from here in the openssl project:
https://github.com/openssl/openssl/blob/2f33265039cdbd0e4589c80970e02e208f3f94d2/crypto/rsa/rsa_pss.c#L95

The gateway is called from a proprietary go testing lib that uses the Go crypto project:
```go
matlsClient := &http.Client{
    Transport: LoggingRoundTripper{
	    Proxied: &http.Transport{
		    TLSClientConfig: &tls.Config{
			    MinVersion: tls.VersionTLS12,
			    RootCAs:    caCertPool,
			    Certificates: []tls.Certificate{{
				    Certificate: [][]byte{
					    parsedCert.Raw,
				    },
				    PrivateKey: key,
			    }},
		    },
	    },
    },
}
```

then:

```go
form.Add("client_id", cfg.ClientID)
form.Add("grant_type", "client_credentials")
form.Add("scope", "directory:software:cert:management")
resp, err := matlsClient.PostForm(*wk.MtlsEndpointAliases.TokenEndpoint, form)
```

which gives the error:

```bash
Received unexpected error:
        Post "https://<token-endpoint>": remote error: tls: error decrypting message
```
similar to https://github.com/golang/go/issues/41983
The key is an RSA signed kms key, the parsed cert is a PKCS#1 v1.5 signed cert. The root ca certs are the CA certs that have been provided, also v1.5 signed.

The only difference between the local version and the deployed version is this:

```
#   Turn this on for reverse proxy
SSLProxyMachineCertificateFile ${SSLPROXYMACHINECERTIFICATEFILE}
SSLProxyMachineCertificateChainFile ${SSLCATRUSTFILE}
ProxyRequests ${USE_MTLS}


<Proxy ${UPSTREAMENDPOINT}*>
  Order deny,allow
  Allow from all
</Proxy>

# block all domains except our target
<ProxyMatch ${UPSTREAMENDPOINTREGEX}>
  Order deny,allow
  Deny from all
</ProxyMatch>
```
For reverse proxy.

----
I have recreated a simple version of this go test, with a self hosted CA and v1.5 signed certs. And they work locally again 😞, so I don't actually have a way of giving a reproduction of the error since this is a closed off system.

And both the testing function and the certs were previously (and continue to) working with the TLS1.2 version.

------

Theories:

1-  The line with the error that I mentioned tests to see if our signing mechanism is being done properly, but here it is testing our signing against RSA_verify_PKCS1_PSS_mgf1 which is for PKCS#1 v2.1 (PSS). 
Our certs are PKCS#1 v1.5, which I got from decoding the certificates with the JS crypto web library. Upon inspection of the decoding in [redkestrel](https://redkestrel.co.uk/tools/decoder), which uses Openssl 3.1.1, the decoding doesn't seem to differentiate between PKCS v1.5 and v2.1. 
So in the go crypto tls client, as the default it uses 1.5 which gets used to sign our certs. And when the apache project renegotiates to tls1.3 with openssl it uses the pss/2.1 verification function (the tls1.3 default for openssl). Which could be the root of the issue, but it is still weird because I tested the same scenario locally and it did not fail.

So I could be either signing properly with PSS, but then the comparison fails to match against our certificates that we are passing in the tls client ( which are probably signed with 1.5); or its signing it with 1.5 but then fails to compare in the openssl function by using the  2.1 standard rather than 1.5.

2-  Possibly related to https://groups.google.com/g/mailing.openssl.users/c/_XSZOwe3isQ?pli=1, because of the way openssl handles integers whose DER encoded value starts with one or more zeros : OpenSSL removes the leading zero when creating the corresponding ASN1_INTEGER structure thus leading to the fact that computed DERs of this structure can be different from the original one. 
Which I believe had been fixed with https://github.com/openssl/openssl/issues/16196?
-----

I am at my wits end and not really sure if this is a bug or just a miss-configuration on my part.
Hopefully, someone could shed a light on this if they have had a similar issue.

Thank you for any help. :)

**Comment by ramongalate** [comment]
@FiloSottile you seem to be one of the only people that have knowledge in both the openssl project and the go crypto package. Could you take a look at it if you have some time? sorry for the CC

**Comment by ramongalate** [comment]
If there is an actual bug, I'll be more than glad to contribute.

**Comment by mattcaswell** [comment]
> Our certs are PKCS#1 v1.5,

It makes no difference what your certs are signed with. This is related to the signature generated during the TLS handshake. So RSA certs signed with pkcs#1 v1.5 can be used to generate PSS signatures.

Can you get a pcap dump of the handshake?

**Reply by ramongalate** [reply]
yes, going to get it

**Reply by ramongalate** [reply]
```
5:21:40.400920 IP ip-172-90-10-5.eu-west-2.compute.internal.42530 > ip-172-90-8-225.eu-west-2.compute.internal.https: Flags [P.], seq 794010444:794010735, ack 4197827655, win 2596, length 291
15:21:40.608466 IP ip-172-90-8-225.eu-west-2.compute.internal.https > ip-172-90-10-5.eu-west-2.compute.internal.42530: Flags [P.], seq 1:325, ack 291, win 5052, length 324
15:21:41.180100 IP ip-172-90-10-5.eu-west-2.compute.internal.60538 > ip-172-90-9-129.eu-west-2.compute.internal.https: Flags [.], seq 2798326950:2798328398, ack 3202845134, win 444, options [nop,nop,TS val 2490988404 ecr 3814400730], length 1448
15:21:41.180108 IP ip-172-90-10-5.eu-west-2.compute.internal.60538 > ip-172-90-9-129.eu-west-2.compute.internal.https: Flags [P.], seq 1448:1946, ack 1, win 444, options [nop,nop,TS val 2490988404 ecr 3814400730], length 498
15:21:41.180167 IP ip-172-90-10-5.eu-west-2.compute.internal.60538 > ip-172-90-9-129.eu-west-2.compute.internal.https: Flags [P.], seq 1946:2731, ack 1, win 444, options [nop,nop,TS val 2490988404 ecr 3814400730], length 785
15:21:41.191704 IP ip-172-90-9-129.eu-west-2.compute.internal.https > ip-172-90-10-5.eu-west-2.compute.internal.60538: Flags [P.], seq 1:197, ack 2731, win 442, options [nop,nop,TS val 3814401729 ecr 2490988404], length 196
15:21:41.191704 IP ip-172-90-9-129.eu-west-2.compute.internal.https > ip-172-90-10-5.eu-west-2.compute.internal.60538: Flags [P.], seq 197:299, ack 2731, win 442, options [nop,nop,TS val 3814401729 ecr 2490988404], length 102
15:21:41.673740 IP ec2-18-175-190-130.eu-west-2.compute.amazonaws.com.57352 > ip-172-90-10-5.eu-west-2.compute.internal.https: Flags [P.], seq 1701854411:1701854692, ack 1184107097, win 502, options [nop,nop,TS val 1015613145 ecr 3979938735], length 281
15:21:41.675270 IP ip-172-90-10-5.eu-west-2.compute.internal.https > ec2-18-175-190-130.eu-west-2.compute.amazonaws.com.57352: Flags [.], seq 1:1449, ack 281, win 488, options [nop,nop,TS val 3979938738 ecr 1015613145], length 1448
15:21:41.675275 IP ip-172-90-10-5.eu-west-2.compute.internal.https > ec2-18-175-190-130.eu-west-2.compute.amazonaws.com.57352: Flags [.], seq 1449:2897, ack 281, win 488, options [nop,nop,TS val 3979938738 ecr 1015613145], length 1448
15:21:41.675277 IP ip-172-90-10-5.eu-west-2.compute.internal.https > ec2-18-175-190-130.eu-west-2.compute.amazonaws.com.57352: Flags [P.], seq 2897:4097, ack 281, win 488, options [nop,nop,TS val 3979938738 ecr 1015613145], length 1200
15:21:41.675299 IP ip-172-90-10-5.eu-west-2.compute.internal.https > ec2-18-175-190-130.eu-west-2.compute.amazonaws.com.57352: Flags [.], seq 4097:5545, ack 281, win 488, options [nop,nop,TS val 3979938738 ecr 1015613145], length 1448
15:21:41.675301 IP ip-172-90-10-5.eu-west-2.compute.internal.https > ec2-18-175-190-130.eu-west-2.compute.amazonaws.com.57352: Flags [.], seq 5545:6993, ack 281, win 488, options [nop,nop,TS val 3979938738 ecr 1015613145], length 1448
15:21:41.675316 IP ip-172-90-10-5.eu-west-2.compute.internal.https > ec2-18-175-190-130.eu-west-2.compute.amazonaws.com.57352: Flags [.], seq 6993:8441, ack 281, win 488, options [nop,nop,TS val 3979938738 ecr 1015613145], length 1448
15:21:41.675318 IP ip-172-90-10-5.eu-west-2.compute.internal.https > ec2-18-175-190-130.eu-west-2.compute.amazonaws.com.57352: Flags [.], seq 8441:9889, ack 281, win 488, options [nop,nop,TS val 3979938738 ecr 1015613145], length 1448
15:21:41.675319 IP ip-172-90-10-5.eu-west-2.compute.internal.https > ec2-18-175-190-130.eu-west-2.compute.amazonaws.com.57352: Flags [P.], seq 9889:11337, ack 281, win 488, options [nop,nop,TS val 3979938738 ecr 1015613145], length 1448
15:21:41.675329 IP ip-172-90-10-5.eu-west-2.compute.internal.https > ec2-18-175-190-130.eu-west-2.compute.amazonaws.com.57352: Flags [P.], seq 11337:11533, ack 281,win 488, options [nop,nop,TS val 3979938738 ecr 1015613145], length 196
15:21:41.676666 IP ip-172-90-10-5.eu-west-2.compute.internal.https > ec2-18-175-190-130.eu-west-2.compute.amazonaws.com.57352: Flags [P.], seq 11533:11893, ack 281,win 488, options [nop,nop,TS val 3979938740 ecr 1015613148], length 360
15:21:41.686739 IP ec2-18-175-190-130.eu-west-2.compute.amazonaws.com.57352 > ip-172-90-10-5.eu-west-2.compute.internal.https: Flags [P.], seq 281:2243, ack 11893, win 501, options [nop,nop,TS val 1015613158 ecr 3979938740], length 1962
15:21:41.686962 IP ec2-18-175-190-130.eu-west-2.compute.amazonaws.com.57352 > ip-172-90-10-5.eu-west-2.compute.internal.https: Flags [P.], seq 2243:3350, ack 11893,win 501, options [nop,nop,TS val 1015613158 ecr 3979938740], length 1107
15:21:41.921705 IP ip-172-90-10-5.eu-west-2.compute.internal.https > ec2-18-175-190-130.eu-west-2.compute.amazonaws.com.57352: Flags [P.], seq 11893:11917, ack 3350, win 465, options [nop,nop,TS val 3979938985 ecr 1015613158], length 24
15:21:41.923104 IP ec2-18-175-190-130.eu-west-2.compute.amazonaws.com.57352 > ip-172-90-10-5.eu-west-2.compute.internal.https: Flags [P.], seq 3350:3374, ack 11917,win 501, options [nop,nop,TS val 1015613395 ecr 3979938985], length 24
15:21:42.647973 IP ip-172-90-10-5.eu-west-2.compute.internal.56952 > ip-172-90-9-163.eu-west-2.compute.internal.https: Flags [P.], seq 2185881488:2185881525, ack 3061227426, win 1853, length 37
15:21:42.657447 IP ip-172-90-9-163.eu-west-2.compute.internal.https > ip-172-90-10-5.eu-west-2.compute.internal.56952: Flags [P.], seq 1:34, ack 37, win 884, length33
15:21:42.821264 IP ip-172-90-10-161.eu-west-2.compute.internal.https > ip-172-90-10-5.eu-west-2.compute.internal.44036: Flags [P.], seq 3584517329:3584517353, ack 967245559, win 465, options [nop,nop,TS val 3341571026 ecr 2860986498], length 24
15:21:42.821498 IP ip-172-90-10-5.eu-west-2.compute.internal.44036 > ip-172-90-10-161.eu-west-2.compute.internal.https: Flags [P.], seq 1:25, ack 25, win 446, options [nop,nop,TS val 2860992500 ecr 3341571026], length 24
15:21:46.559301 IP ip-172-90-10-5.eu-west-2.compute.internal.32842 > ip-172-90-8-89.eu-west-2.compute.internal.https: Flags [P.], seq 2312743417:2312743705, ack 2437303995, win 491, options [nop,nop,TS val 2110492377 ecr 3763630591], length 288
15:21:46.560293 IP ip-172-90-8-89.eu-west-2.compute.internal.https > ip-172-90-10-5.eu-west-2.compute.internal.32842: Flags [P.], seq 1:94, ack 288, win 487, options [nop,nop,TS val 3763630592 ecr 2110492377], length 93
15:21:46.560293 IP ip-172-90-8-89.eu-west-2.compute.internal.https > ip-172-90-10-5.eu-west-2.compute.internal.32842: Flags [P.], seq 94:100, ack 288, win 487, options [nop,nop,TS val 3763630592 ecr 2110492377], length 6
15:21:46.560383 IP ip-172-90-10-5.eu-west-2.compute.internal.32842 > ip-172-90-8-89.eu-west-2.compute.internal.https: Flags [P.], seq 288:294, ack 100, win 491, options [nop,nop,TS val 2110492378 ecr 3763630592], length 6
15:21:46.560485 IP ip-172-90-10-5.eu-west-2.compute.internal.32842 > ip-172-90-8-89.eu-west-2.compute.internal.https: Flags [P.], seq 294:615, ack 100, win 491, options [nop,nop,TS val 2110492379 ecr 3763630592], length 321
15:21:46.561328 IP ip-172-90-8-89.eu-west-2.compute.internal.https > ip-172-90-10-5.eu-west-2.compute.internal.32842: Flags [P.], seq 100:260, ack 615, win 485, options [nop,nop,TS val 3763630594 ecr 2110492379], length 160
15:21:46.561591 IP ip-172-90-8-89.eu-west-2.compute.internal.https > ip-172-90-10-5.eu-west-2.compute.internal.32842: Flags [P.], seq 260:307, ack 615, win 485, options [nop,nop,TS val 3763630594 ecr 2110492379], length 47
15:21:46.561591 IP ip-172-90-8-89.eu-west-2.compute.internal.https > ip-172-90-10-5.eu-west-2.compute.internal.32842: Flags [P.], seq 307:5466, ack 615, win 485, options [nop,nop,TS val 3763630594 ecr 2110492379], length 5159
15:21:46.562044 IP ip-172-90-8-89.eu-west-2.compute.internal.https > ip-172-90-10-5.eu-west-2.compute.internal.32842: Flags [P.], seq 5466:5752, ack 615, win 485, options [nop,nop,TS val 3763630594 ecr 2110492379], length 286
15:21:46.562321 IP ip-172-90-8-89.eu-west-2.compute.internal.https > ip-172-90-10-5.eu-west-2.compute.internal.32842: Flags [P.], seq 5752:5810, ack 615, win 485, options [nop,nop,TS val 3763630594 ecr 2110492379], length 58
15:21:46.562423 IP ip-172-90-10-5.eu-west-2.compute.internal.32842 > ip-172-90-8-89.eu-west-2.compute.internal.https: Flags [P.], seq 615:673, ack 5810, win 448, options [nop,nop,TS val 2110492381 ecr 3763630594], length 58
15:21:46.562559 IP ip-172-90-10-5.eu-west-2.compute.internal.32842 > ip-172-90-8-89.eu-west-2.compute.internal.https: Flags [P.], seq 673:1881, ack 5810, win 448, options [nop,nop,TS val 2110492381 ecr 3763630594], length 1208
15:21:46.562594 IP ip-172-90-10-5.eu-west-2.compute.internal.32842 > ip-172-90-8-89.eu-west-2.compute.internal.https: Flags [P.], seq 1881:2970, ack 5810, win 448, options [nop,nop,TS val 2110492381 ecr 3763630594], length 1089
15:21:46.562615 IP ip-172-90-10-5.eu-west-2.compute.internal.32842 > ip-172-90-8-89.eu-west-2.compute.internal.https: Flags [.], seq 2970:4418, ack 5810, win 448, options [nop,nop,TS val 2110492381 ecr 3763630594], length 1448
15:21:46.562617 IP ip-172-90-10-5.eu-west-2.compute.internal.32842 > ip-172-90-8-89.eu-west-2.compute.internal.https: Flags [P.], seq 4418:4934, ack 5810, win 448, options [nop,nop,TS val 2110492381 ecr 3763630594], length 516
15:21:46.595899 IP ip-172-90-8-89.eu-west-2.compute.internal.https > ip-172-90-10-5.eu-west-2.compute.internal.32842: Flags [P.], seq 5810:6006, ack 4934, win 453, options [nop,nop,TS val 3763630628 ecr 2110492381], length 196
15:21:46.596188 IP ip-172-90-8-89.eu-west-2.compute.internal.https > ip-172-90-10-5.eu-west-2.compute.internal.32842: Flags [P.], seq 6006:6108, ack 4934, win 453, options [nop,nop,TS val 3763630628 ecr 2110492381], length 102
15:21:47.192640 IP ip-172-90-9-129.eu-west-2.compute.internal.https > ip-172-90-10-5.eu-west-2.compute.internal.60538: Flags [P.], seq 299:323, ack 2731, win 442, options [nop,nop,TS val 3814407730 ecr 2490988416], length 24
15:21:47.192816 IP ip-172-90-10-5.eu-west-2.compute.internal.60538 > ip-172-90-9-129.eu-west-2.compute.internal.https: Flags [P.], seq 2731:2755, ack 324, win 443, options [nop,nop,TS val 2490994417 ecr 3814407730], length 24
15:21:51.671901 IP ip-172-90-10-5.eu-west-2.compute.internal.32842 > ip-172-90-8-89.eu-west-2.compute.internal.https: Flags [.], seq 4934:6382, ack 6108, win 446, options [nop,nop,TS val 2110497490 ecr 3763630628], length 1448
15:21:51.671909 IP ip-172-90-10-5.eu-west-2.compute.internal.32842 > ip-172-90-8-89.eu-west-2.compute.internal.https: Flags [P.], seq 6382:7250, ack 6108, win 446, options [nop,nop,TS val 2110497490 ecr 3763630628], length 868
15:21:51.671965 IP ip-172-90-10-5.eu-west-2.compute.internal.32842 > ip-172-90-8-89.eu-west-2.compute.internal.https: Flags [P.], seq 7250:7713, ack 6108, win 446, options [nop,nop,TS val 2110497490 ecr 3763630628], length 463
15:21:51.681906 IP ip-172-90-8-89.eu-west-2.compute.internal.https > ip-172-90-10-5.eu-west-2.compute.internal.32842: Flags [P.], seq 6108:6304, ack 7713, win 442, options [nop,nop,TS val 3763635714 ecr 2110497490], length 196
15:21:51.681906 IP ip-172-90-8-89.eu-west-2.compute.internal.https > ip-172-90-10-5.eu-west-2.compute.internal.32842: Flags [P.], seq 6304:6406, ack 7713, win 442, options [nop,nop,TS val 3763635714 ecr 2110497490], length 102
15:21:57.688023 IP ip-172-90-8-89.eu-west-2.compute.internal.https > ip-172-90-10-5.eu-west-2.compute.internal.32842: Flags [P.], seq 6406:6430, ack 7713, win 442, options [nop,nop,TS val 3763641720 ecr 2110497500], length 24
15:21:57.688251 IP ip-172-90-10-5.eu-west-2.compute.internal.32842 > ip-172-90-8-89.eu-west-2.compute.internal.https: Flags [P.], seq 7713:7737, ack 6431, win 444, options [nop,nop,TS val 2110503506 ecr 3763641720], length 24
15:22:00.677183 IP ip-172-90-10-5.eu-west-2.compute.internal.54068 > ip-172-90-10-161.eu-west-2.compute.internal.https: Flags [P.], seq 400656383:400656671, ack 2745597070, win 491, options [nop,nop,TS val 2861010355 ecr 2866278250], length 288
15:22:00.678533 IP ip-172-90-10-161.eu-west-2.compute.internal.https > ip-172-90-10-5.eu-west-2.compute.internal.54068: Flags [P.], seq 1:94, ack 288, win 487, options [nop,nop,TS val 2866278252 ecr 2861010355], length 93
15:22:00.678593 IP ip-172-90-10-161.eu-west-2.compute.internal.https > ip-172-90-10-5.eu-west-2.compute.internal.54068: Flags [P.], seq 94:100, ack 288, win 487, options [nop,nop,TS val 2866278252 ecr 2861010355], length 6
15:22:00.678674 IP ip-172-90-10-5.eu-west-2.compute.internal.54068 > ip-172-90-10-161.eu-west-2.compute.internal.https: Flags [P.], seq 288:294, ack 100, win 491, options [nop,nop,TS val 2861010357 ecr 2866278252], length 6
15:22:00.678806 IP ip-172-90-10-5.eu-west-2.compute.internal.54068 > ip-172-90-10-161.eu-west-2.compute.internal.https: Flags [P.], seq 294:615, ack 100, win 491, options [nop,nop,TS val 2861010357 ecr 2866278252], length 321
15:22:00.680284 IP ip-172-90-10-161.eu-west-2.compute.internal.https > ip-172-90-10-5.eu-west-2.compute.internal.54068: Flags [P.], seq 100:260, ack 615, win 485, options [nop,nop,TS val 2866278254 ecr 2861010357], length 160
15:22:00.680419 IP ip-172-90-10-161.eu-west-2.compute.internal.https > ip-172-90-10-5.eu-west-2.compute.internal.54068: Flags [P.], seq 260:307, ack 615, win 485, options [nop,nop,TS val 2866278254 ecr 2861010357], length 47
15:22:00.680476 IP ip-172-90-10-161.eu-west-2.compute.internal.https > ip-172-90-10-5.eu-west-2.compute.internal.54068: Flags [P.], seq 307:5466, ack 615, win 485, options [nop,nop,TS val 2866278254 ecr 2861010357], length 5159
15:22:00.681045 IP ip-172-90-10-161.eu-west-2.compute.internal.https > ip-172-90-10-5.eu-west-2.compute.internal.54068: Flags [P.], seq 5466:5752, ack 615, win 485,options [nop,nop,TS val 2866278255 ecr 2861010357], length 286
15:22:00.681046 IP ip-172-90-10-161.eu-west-2.compute.internal.https > ip-172-90-10-5.eu-west-2.compute.internal.54068: Flags [P.], seq 5752:5810, ack 615, win 485,options [nop,nop,TS val 2866278255 ecr 2861010357], length 58
15:22:00.681321 IP ip-172-90-10-5.eu-west-2.compute.internal.54068 > ip-172-90-10-161.eu-west-2.compute.internal.https: Flags [P.], seq 615:673, ack 5810, win 448, options [nop,nop,TS val 2861010359 ecr 2866278255], length 58
15:22:00.681503 IP ip-172-90-10-5.eu-west-2.compute.internal.54068 > ip-172-90-10-161.eu-west-2.compute.internal.https: Flags [P.], seq 673:1881, ack 5810, win 448,options [nop,nop,TS val 2861010360 ecr 2866278255], length 1208
15:22:00.681536 IP ip-172-90-10-5.eu-west-2.compute.internal.54068 > ip-172-90-10-161.eu-west-2.compute.internal.https: Flags [P.], seq 1881:3319, ack 5810, win 448, options [nop,nop,TS val 2861010360 ecr 2866278255], length 1438
15:22:00.707888 IP ip-172-90-10-161.eu-west-2.compute.internal.https > ip-172-90-10-5.eu-west-2.compute.internal.54068: Flags [P.], seq 5810:6006, ack 3319, win 465, options [nop,nop,TS val 2866278282 ecr 2861010360], length 196
15:22:00.707888 IP ip-172-90-10-161.eu-west-2.compute.internal.https > ip-172-90-10-5.eu-west-2.compute.internal.54068: Flags [P.], seq 6006:6108, ack 3319, win 465, options [nop,nop,TS val 2866278282 ecr 2861010360], length 102
15:22:06.611461 IP ip-172-90-10-5.eu-west-2.compute.internal.54068 > ip-172-90-10-161.eu-west-2.compute.internal.https: Flags [.], seq 3319:4767, ack 6108, win 446,options [nop,nop,TS val 2861016290 ecr 2866278282], length 1448
15:22:06.611471 IP ip-172-90-10-5.eu-west-2.compute.internal.54068 > ip-172-90-10-161.eu-west-2.compute.internal.https: Flags [P.], seq 4767:5593, ack 6108, win 446, options [nop,nop,TS val 2861016290 ecr 2866278282], length 826
15:22:06.611547 IP ip-172-90-10-5.eu-west-2.compute.internal.54068 > ip-172-90-10-161.eu-west-2.compute.internal.https: Flags [P.], seq 5593:6032, ack 6108, win 446, options [nop,nop,TS val 2861016290 ecr 2866278282], length 439
15:22:06.622358 IP ip-172-90-10-161.eu-west-2.compute.internal.https > ip-172-90-10-5.eu-west-2.compute.internal.54068: Flags [P.], seq 6108:6304, ack 6032, win 445, options [nop,nop,TS val 2866284196 ecr 2861016290], length 196
15:22:06.622359 IP ip-172-90-10-161.eu-west-2.compute.internal.https > ip-172-90-10-5.eu-west-2.compute.internal.54068: Flags [P.], seq 6304:6406, ack 6032, win 445, options [nop,nop,TS val 2866284196 ecr 2861016290], length 102
15:22:08.495717 IP ip-172-90-10-5.eu-west-2.compute.internal.39096 > 52.94.58.73.https: Flags [P.], seq 3438798756:3438799050, ack 118393250, win 491, length 294
15:22:08.499702 IP 52.94.58.73.https > ip-172-90-10-5.eu-west-2.compute.internal.39096: Flags [P.], seq 1:94, ack 294, win 976, length 93
15:22:08.499702 IP 52.94.58.73.https > ip-172-90-10-5.eu-west-2.compute.internal.39096: Flags [P.], seq 94:100, ack 294, win 976, length 6
15:22:08.500117 IP ip-172-90-10-5.eu-west-2.compute.internal.39096 > 52.94.58.73.https: Flags [P.], seq 294:300, ack 100, win 491, length 6
15:22:08.500359 IP ip-172-90-10-5.eu-west-2.compute.internal.39096 > 52.94.58.73.https: Flags [P.], seq 300:627, ack 100, win 491, length 327
15:22:08.503113 IP 52.94.58.73.https > ip-172-90-10-5.eu-west-2.compute.internal.39096: Flags [P.], seq 100:260, ack 627, win 972, length 160
15:22:08.503113 IP 52.94.58.73.https > ip-172-90-10-5.eu-west-2.compute.internal.39096: Flags [P.], seq 260:307, ack 627, win 972, length 47
15:22:08.503114 IP 52.94.58.73.https > ip-172-90-10-5.eu-west-2.compute.internal.39096: Flags [P.], seq 307:5366, ack 627, win 972, length 5059
15:22:08.503684 IP 52.94.58.73.https > ip-172-90-10-5.eu-west-2.compute.internal.39096: Flags [P.], seq 5366:5652, ack 627, win 972, length 286
15:22:08.503685 IP 52.94.58.73.https > ip-172-90-10-5.eu-west-2.compute.internal.39096: Flags [P.], seq 5652:5710, ack 627, win 972, length 58
15:22:08.504389 IP ip-172-90-10-5.eu-west-2.compute.internal.39096 > 52.94.58.73.https: Flags [P.], seq 627:685, ack 5710, win 448, length 58
15:22:08.504529 IP ip-172-90-10-5.eu-west-2.compute.internal.39096 > 52.94.58.73.https: Flags [P.], seq 685:1893, ack 5710, win 448, length 1208
15:22:08.504563 IP ip-172-90-10-5.eu-west-2.compute.internal.39096 > 52.94.58.73.https: Flags [.], seq 1893:3353, ack 5710, win 448, length 1460
15:22:08.504565 IP ip-172-90-10-5.eu-west-2.compute.internal.39096 > 52.94.58.73.https: Flags [.], seq 3353:4813, ack 5710, win 448, length 1460
15:22:08.504567 IP ip-172-90-10-5.eu-west-2.compute.internal.39096 > 52.94.58.73.https: Flags [P.], seq 4813:5672, ack 5710, win 448, length 859
15:22:08.516143 IP 52.94.58.73.https > ip-172-90-10-5.eu-west-2.compute.internal.39096: Flags [P.], seq 5710:5896, ack 5672, win 896, length 186
15:22:08.516143 IP 52.94.58.73.https > ip-172-90-10-5.eu-west-2.compute.internal.39096: Flags [P.], seq 5896:6389, ack 5672, win 896, length 493
15:22:12.747291 IP ip-172-90-10-161.eu-west-2.compute.internal.https > ip-172-90-10-5.eu-west-2.compute.internal.54068: Flags [P.], seq 6406:6430, ack 6032, win 445, options [nop,nop,TS val 2866290321 ecr 2861016301], length 24
15:22:12.747499 IP ip-172-90-10-5.eu-west-2.compute.internal.54068 > ip-172-90-10-161.eu-west-2.compute.internal.https: Flags [P.], seq 6032:6056, ack 6431, win 444, options [nop,nop,TS val 2861022426 ecr 2866290321], length 24
15:22:14.518250 IP 52.94.58.73.https > ip-172-90-10-5.eu-west-2.compute.internal.39096: Flags [P.], seq 6389:6413, ack 5672, win 896, length 24
15:22:14.518417 IP ip-172-90-10-5.eu-west-2.compute.internal.39096 > 52.94.58.73.https: Flags [P.], seq 5672:5696, ack 6414, win 443, length 24
15:22:16.639718 IP ip-172-90-10-5.eu-west-2.compute.internal.49786 > ip-172-90-9-129.eu-west-2.compute.internal.https: Flags [P.], seq 2046886085:2046886373, ack 1459801566, win 491, options [nop,nop,TS val 2491023864 ecr 752870889], length 288
15:22:16.641171 IP ip-172-90-9-129.eu-west-2.compute.internal.https > ip-172-90-10-5.eu-west-2.compute.internal.49786: Flags [P.], seq 1:94, ack 288, win 487, options [nop,nop,TS val 752870891 ecr 2491023864], length 93
15:22:16.641171 IP ip-172-90-9-129.eu-west-2.compute.internal.https > ip-172-90-10-5.eu-west-2.compute.internal.49786: Flags [P.], seq 94:100, ack 288, win 487, options [nop,nop,TS val 752870891 ecr 2491023864], length 6
15:22:16.641282 IP ip-172-90-10-5.eu-west-2.compute.internal.49786 > ip-172-90-9-129.eu-west-2.compute.internal.https: Flags [P.], seq 288:294, ack 100, win 491, options [nop,nop,TS val 2491023865 ecr 752870891], length 6
15:22:16.641480 IP ip-172-90-10-5.eu-west-2.compute.internal.49786 > ip-172-90-9-129.eu-west-2.compute.internal.https: Flags [P.], seq 294:615, ack 100, win 491, options [nop,nop,TS val 2491023866 ecr 752870891], length 321
15:22:16.642843 IP ip-172-90-9-129.eu-west-2.compute.internal.https > ip-172-90-10-5.eu-west-2.compute.internal.49786: Flags [P.], seq 100:260, ack 615, win 485, options [nop,nop,TS val 752870893 ecr 2491023866], length 160
15:22:16.643049 IP ip-172-90-9-129.eu-west-2.compute.internal.https > ip-172-90-10-5.eu-west-2.compute.internal.49786: Flags [P.], seq 260:307, ack 615, win 485, options [nop,nop,TS val 752870893 ecr 2491023866], length 47
15:22:16.643050 IP ip-172-90-9-129.eu-west-2.compute.internal.https > ip-172-90-10-5.eu-west-2.compute.internal.49786: Flags [P.], seq 307:5466, ack 615, win 485, options [nop,nop,TS val 752870893 ecr 2491023866], length 5159
15:22:16.643634 IP ip-172-90-9-129.eu-west-2.compute.internal.https > ip-172-90-10-5.eu-west-2.compute.internal.49786: Flags [P.], seq 5466:5752, ack 615, win 485, options [nop,nop,TS val 752870894 ecr 2491023866], length 286
15:22:16.643634 IP ip-172-90-9-129.eu-west-2.compute.internal.https > ip-172-90-10-5.eu-west-2.compute.internal.49786: Flags [P.], seq 5752:5810, ack 615, win 485, options [nop,nop,TS val 752870894 ecr 2491023866], length 58
15:22:16.644045 IP ip-172-90-10-5.eu-west-2.compute.internal.49786 > ip-172-90-9-129.eu-west-2.compute.internal.https: Flags [P.], seq 615:673, ack 5810, win 448, options [nop,nop,TS val 2491023868 ecr 752870894], length 58
15:22:16.644205 IP ip-172-90-10-5.eu-west-2.compute.internal.49786 > ip-172-90-9-129.eu-west-2.compute.internal.https: Flags [P.], seq 673:1881, ack 5810, win 448, options [nop,nop,TS val 2491023868 ecr 752870894], length 1208
15:22:16.644240 IP ip-172-90-10-5.eu-west-2.compute.internal.49786 > ip-172-90-9-129.eu-west-2.compute.internal.https: Flags [.], seq 1881:3329, ack 5810, win 448, options [nop,nop,TS val 2491023868 ecr 752870894], length 1448
15:22:16.644242 IP ip-172-90-10-5.eu-west-2.compute.internal.49786 > ip-172-90-9-129.eu-west-2.compute.internal.https: Flags [P.], seq 3329:3407, ack 5810, win 448,options [nop,nop,TS val 2491023868 ecr 752870894], length 78
15:22:16.675243 IP ip-172-90-9-129.eu-west-2.compute.internal.https > ip-172-90-10-5.eu-west-2.compute.internal.49786: Flags [P.], seq 5810:6006, ack 3407, win 465,options [nop,nop,TS val 752870925 ecr 2491023868], length 196
15:22:16.675243 IP ip-172-90-9-129.eu-west-2.compute.internal.https > ip-172-90-10-5.eu-west-2.compute.internal.49786: Flags [P.], seq 6006:6108, ack 3407, win 465,options [nop,nop,TS val 752870925 ecr 2491023868], length 102
15:22:22.677756 IP ip-172-90-9-129.eu-west-2.compute.internal.https > ip-172-90-10-5.eu-west-2.compute.internal.49786: Flags [P.], seq 6108:6132, ack 3407, win 465,options [nop,nop,TS val 752876928 ecr 2491023900], length 24
15:22:22.677918 IP ip-172-90-10-5.eu-west-2.compute.internal.49786 > ip-172-90-9-129.eu-west-2.compute.internal.https: Flags [P.], seq 3407:3431, ack 6133, win 446,options [nop,nop,TS val 2491029902 ecr 752876928], length 24
15:22:26.210683 IP ec2-3-9-40-8.eu-west-2.compute.amazonaws.com.65149 > ip-172-90-10-5.eu-west-2.compute.internal.https: Flags [P.], seq 727139551:727139822, ack 3241444768, win 491, options [nop,nop,TS val 1943496665 ecr 2313022121], length 271
15:22:26.212448 IP ip-172-90-10-5.eu-west-2.compute.internal.https > ec2-3-9-40-8.eu-west-2.compute.amazonaws.com.65149: Flags [.], seq 1:1449, ack 271, win 488, options [nop,nop,TS val 2313022125 ecr 1943496665], length 1448
15:22:26.212454 IP ip-172-90-10-5.eu-west-2.compute.internal.https > ec2-3-9-40-8.eu-west-2.compute.amazonaws.com.65149: Flags [.], seq 1449:2897, ack 271, win 488,options [nop,nop,TS val 2313022125 ecr 1943496665], length 1448
15:22:26.212456 IP ip-172-90-10-5.eu-west-2.compute.internal.https > ec2-3-9-40-8.eu-west-2.compute.amazonaws.com.65149: Flags [P.], seq 2897:4097, ack 271, win 488, options [nop,nop,TS val 2313022125 ecr 1943496665], length 1200
15:22:26.212478 IP ip-172-90-10-5.eu-west-2.compute.internal.https > ec2-3-9-40-8.eu-west-2.compute.amazonaws.com.65149: Flags [.], seq 4097:5545, ack 271, win 488,options [nop,nop,TS val 2313022125 ecr 1943496665], length 1448
15:22:26.212480 IP ip-172-90-10-5.eu-west-2.compute.internal.https > ec2-3-9-40-8.eu-west-2.compute.amazonaws.com.65149: Flags [.], seq 5545:6993, ack 271, win 488,options [nop,nop,TS val 2313022125 ecr 1943496665], length 1448
15:22:26.212481 IP ip-172-90-10-5.eu-west-2.compute.internal.https > ec2-3-9-40-8.eu-west-2.compute.amazonaws.com.65149: Flags [.], seq 6993:8441, ack 271, win 488,options [nop,nop,TS val 2313022125 ecr 1943496665], length 1448
15:22:26.212497 IP ip-172-90-10-5.eu-west-2.compute.internal.https > ec2-3-9-40-8.eu-west-2.compute.amazonaws.com.65149: Flags [.], seq 8441:9889, ack 271, win 488,options [nop,nop,TS val 2313022125 ecr 1943496665], length 1448
15:22:26.212498 IP ip-172-90-10-5.eu-west-2.compute.internal.https > ec2-3-9-40-8.eu-west-2.compute.amazonaws.com.65149: Flags [P.], seq 9889:11337, ack 271, win 488, options [nop,nop,TS val 2313022125 ecr 1943496665], length 1448
15:22:26.212509 IP ip-172-90-10-5.eu-west-2.compute.internal.https > ec2-3-9-40-8.eu-west-2.compute.amazonaws.com.65149: Flags [P.], seq 11337:11533, ack 271, win 488, options [nop,nop,TS val 2313022125 ecr 1943496665], length 196
15:22:26.213911 IP ip-172-90-10-5.eu-west-2.compute.internal.https > ec2-3-9-40-8.eu-west-2.compute.amazonaws.com.65149: Flags [P.], seq 11533:11893, ack 271, win 488, options [nop,nop,TS val 2313022126 ecr 1943496667], length 360
15:22:26.223030 IP ec2-3-9-40-8.eu-west-2.compute.amazonaws.com.65149 > ip-172-90-10-5.eu-west-2.compute.internal.https: Flags [P.], seq 271:2233, ack 11893, win 443, options [nop,nop,TS val 1943496677 ecr 2313022126], length 1962
15:22:26.223109 IP ec2-3-9-40-8.eu-west-2.compute.amazonaws.com.65149 > ip-172-90-10-5.eu-west-2.compute.internal.https: Flags [P.], seq 2233:2549, ack 11893, win 443, options [nop,nop,TS val 1943496677 ecr 2313022126], length 316
15:22:26.450767 IP ip-172-90-10-5.eu-west-2.compute.internal.https > ec2-3-9-40-8.eu-west-2.compute.amazonaws.com.65149: Flags [P.], seq 11893:11917, ack 2549, win 471, options [nop,nop,TS val 2313022363 ecr 1943496677], length 24
15:22:26.451685 IP ec2-3-9-40-8.eu-west-2.compute.amazonaws.com.65149 > ip-172-90-10-5.eu-west-2.compute.internal.https: Flags [P.], seq 2549:2573, ack 11917, win 443, options [nop,nop,TS val 1943496906 ecr 2313022363], length 24
15:22:26.669647 IP ip-172-90-10-5.eu-west-2.compute.internal.59702 > ip-172-90-8-89.eu-west-2.compute.internal.https: Flags [P.], seq 475992428:475992716, ack 1840655449, win 491, options [nop,nop,TS val 2110532488 ecr 306703553], length 288
15:22:26.670649 IP ip-172-90-8-89.eu-west-2.compute.internal.https > ip-172-90-10-5.eu-west-2.compute.internal.59702: Flags [P.], seq 1:94, ack 288, win 487, options [nop,nop,TS val 306703555 ecr 2110532488], length 93
15:22:26.670649 IP ip-172-90-8-89.eu-west-2.compute.internal.https > ip-172-90-10-5.eu-west-2.compute.internal.59702: Flags [P.], seq 94:100, ack 288, win 487, options [nop,nop,TS val 306703555 ecr 2110532488], length 6
15:22:26.670756 IP ip-172-90-10-5.eu-west-2.compute.internal.59702 > ip-172-90-8-89.eu-west-2.compute.internal.https: Flags [P.], seq 288:294, ack 100, win 491, options [nop,nop,TS val 2110532489 ecr 306703555], length 6
15:22:26.670855 IP ip-172-90-10-5.eu-west-2.compute.internal.59702 > ip-172-90-8-89.eu-west-2.compute.internal.https: Flags [P.], seq 294:615, ack 100, win 491, options [nop,nop,TS val 2110532489 ecr 306703555], length 321
15:22:26.672467 IP ip-172-90-8-89.eu-west-2.compute.internal.https > ip-172-90-10-5.eu-west-2.compute.internal.59702: Flags [P.], seq 100:260, ack 615, win 485, options [nop,nop,TS val 306703556 ecr 2110532489], length 160
15:22:26.672467 IP ip-172-90-8-89.eu-west-2.compute.internal.https > ip-172-90-10-5.eu-west-2.compute.internal.59702: Flags [P.], seq 260:307, ack 615, win 485, options [nop,nop,TS val 306703557 ecr 2110532489], length 47
15:22:26.672467 IP ip-172-90-8-89.eu-west-2.compute.internal.https > ip-172-90-10-5.eu-west-2.compute.internal.59702: Flags [P.], seq 307:5466, ack 615, win 485, options [nop,nop,TS val 306703557 ecr 2110532489], length 5159
15:22:26.673131 IP ip-172-90-8-89.eu-west-2.compute.internal.https > ip-172-90-10-5.eu-west-2.compute.internal.59702: Flags [P.], seq 5466:5752, ack 615, win 485, options [nop,nop,TS val 306703557 ecr 2110532489], length 286
15:22:26.673131 IP ip-172-90-8-89.eu-west-2.compute.internal.https > ip-172-90-10-5.eu-west-2.compute.internal.59702: Flags [P.], seq 5752:5810, ack 615, win 485, options [nop,nop,TS val 306703557 ecr 2110532489], length 58
15:22:26.673512 IP ip-172-90-10-5.eu-west-2.compute.internal.59702 > ip-172-90-8-89.eu-west-2.compute.internal.https: Flags [P.], seq 615:673, ack 5810, win 448, options [nop,nop,TS val 2110532492 ecr 306703557], length 58
15:22:26.673726 IP ip-172-90-10-5.eu-west-2.compute.internal.59702 > ip-172-90-8-89.eu-west-2.compute.internal.https: Flags [P.], seq 673:1881, ack 5810, win 448, options [nop,nop,TS val 2110532492 ecr 306703557], length 1208
15:22:26.673765 IP ip-172-90-10-5.eu-west-2.compute.internal.59702 > ip-172-90-8-89.eu-west-2.compute.internal.https: Flags [P.], seq 1881:2970, ack 5810, win 448, options [nop,nop,TS val 2110532492 ecr 306703557], length 1089
15:22:26.673791 IP ip-172-90-10-5.eu-west-2.compute.internal.59702 > ip-172-90-8-89.eu-west-2.compute.internal.https: Flags [.], seq 2970:4418, ack 5810, win 448, options [nop,nop,TS val 2110532492 ecr 306703557], length 1448
15:22:26.673794 IP ip-172-90-10-5.eu-west-2.compute.internal.59702 > ip-172-90-8-89.eu-west-2.compute.internal.https: Flags [P.], seq 4418:4600, ack 5810, win 448, options [nop,nop,TS val 2110532492 ecr 306703557], length 182
15:22:26.703368 IP ip-172-90-8-89.eu-west-2.compute.internal.https > ip-172-90-10-5.eu-west-2.compute.internal.59702: Flags [P.], seq 5810:6006, ack 4600, win 456, options [nop,nop,TS val 306703588 ecr 2110532492], length 196
15:22:26.703368 IP ip-172-90-8-89.eu-west-2.compute.internal.https > ip-172-90-10-5.eu-west-2.compute.internal.59702: Flags [P.], seq 6006:6108, ack 4600, win 456, options [nop,nop,TS val 306703588 ecr 2110532492], length 102
15:22:31.705285 IP ip-172-90-10-5.eu-west-2.compute.internal.59702 > ip-172-90-8-89.eu-west-2.compute.internal.https: Flags [.], seq 4600:6048, ack 6108, win 446, options [nop,nop,TS val 2110537523 ecr 306703588], length 1448
15:22:31.705292 IP ip-172-90-10-5.eu-west-2.compute.internal.59702 > ip-172-90-8-89.eu-west-2.compute.internal.https: Flags [P.], seq 6048:6876, ack 6108, win 446, options [nop,nop,TS val 2110537523 ecr 306703588], length 828
15:22:31.705436 IP ip-172-90-10-5.eu-west-2.compute.internal.59702 > ip-172-90-8-89.eu-west-2.compute.internal.https: Flags [P.], seq 6876:8088, ack 6108, win 446, options [nop,nop,TS val 2110537524 ecr 306703588], length 1212
15:22:31.716947 IP ip-172-90-8-89.eu-west-2.compute.internal.https > ip-172-90-10-5.eu-west-2.compute.internal.59702: Flags [P.], seq 6108:6304, ack 8088, win 442, options [nop,nop,TS val 306708601 ecr 2110537524], length 196
15:22:31.716947 IP ip-172-90-8-89.eu-west-2.compute.internal.https > ip-172-90-10-5.eu-west-2.compute.internal.59702: Flags [P.], seq 6304:6406, ack 8088, win 442, options [nop,nop,TS val 306708601 ecr 2110537524], length 102
```

**Reply by ramongalate** [reply]
here is the tls pcap dump during the handshake @mattcaswell

**Reply by ramongalate** [reply]
the dump doesn't indicate an issue during the handshake. which suggests that the problem may not be at the SSL protocol level, but rather at a different layer (e.g., configuration or certificate issues).

**Reply by mattcaswell** [reply]
Can you get it to me in the form of .pcap file that I can load into wireshark?

**Reply by ramongalate** [reply]
[handshake.pcap.zip](https://github.com/user-attachments/files/16636742/handshake.pcap.zip)

**Reply by ramongalate** [reply]
I just opened it up using wireshark, could this be an issue similar to this:
https://github.com/golang/go/issues/41983
about the order of the change_cipher_spec and client_hellos

**Reply by ramongalate** [reply]
[handshake2.pcap.zip](https://github.com/user-attachments/files/16636952/handshake2.pcap.zip)
this one is a little better @mattcaswell

**Comment by ramongalate** [comment]
@mattcaswell were you able to see anything that could help?

**Comment by ramongalate** [comment, marked as answer]
I eventually found the issue, not a bug on the openssl side neither on the httpd apache side.

I was implementing a mutual tls implementation and the client side signing mechanism, depending on the language, hardcodes the signing mechanism of the connection. 

The client mechanism needed to use PSS mode signing.
