### ISSUE TITLE
What is the default value for `SSL_CTX_sess_connect`

### ISSUE THREAD

**Issue by Cappuccinuo** [openssl/openssl#18116]
I am seeing following stunnel logs, and trace back in the source code, it is calling `SSL_CTX_sess_connect` to emit the first line

```output
2022.04.14 08:56:49 LOG7[0]:      2 client connect(s) requested
2022.04.14 08:56:49 LOG7[0]:      1 client connect(s) succeeded
2022.04.14 08:56:49 LOG7[0]:      0 client renegotiation(s) requested
2022.04.14 08:56:49 LOG7[0]:      0 session reuse(s)
```

Based on official doc

> SSL_CTX_sess_connect() returns the number of started SSL/TLS handshakes in client mode.

My question is:

**When we init a new SSL context using [SSL_CTX_new_ex](https://github.com/openssl/openssl/blob/09134f183f76539aa1294adfef10fcc694e90267/ssl/ssl_lib.c#L3187), how is the default value assigned to `SSL_CTRL_SESS_CONNECT`, i.e. how many TLS handshake session is by default initiated when a new context is established?**

Seems to be 2, but I cannot find where exactly this is defined, can anyone help me? Thanks in advance.

**Comment by Cappuccinuo** [comment]
I think for a default context, the value will be 0. Then when will this stat get increased? i.e. why the handshake will create two connect?

```output
>>> context=ssl.SSLContext()
>>> context.session_stats()
{'number': 0, 'connect': 0, 'connect_good': 0, 'connect_renegotiate': 0, 'accept': 0, 'accept_good': 0, 'accept_renegotiate': 0, 'hits': 0, 'misses': 0, 'timeouts': 0, 'cache_full': 0}
```

**Comment by kaduk** [comment]
The default/initial value for all the SSL_CTX statistics is zero, as they are event counters.
The increment seems to occur at https://github.com/openssl/openssl/blob/e915c3f5381cd38ebdc1824c3ba9896ea7160103/ssl/statem/statem_lib.c#L186-L187 but looking at the ways that function is called, I don't see an obvious way for it to get called twice.

I note that your stunnel logs show only one successful client connection out of the two attempts, so that makes me wonder if the first attempt is failing and it is doing some sort of fallback on a second attempt that succeeds.  A packet capture should be able to clarify that, or if you have the configuration settings of the client and server available.

**Comment by Cappuccinuo** [comment]
Thanks @kaduk for the answer,

The two connects all succeed, that is my paste issue

```output
2022.04.14 08:56:49 LOG7[1]: Deallocating application specific data for session connect address
2022.04.14 08:56:49 LOG6[1]: Session id: F00B7B4466A1329C679D1A2C4200DF40B2BF78153B2E3FD44B75E01BC0ECFE04
2022.04.14 08:56:49 LOG7[1]:      2 client connect(s) requested
2022.04.14 08:56:49 LOG7[1]:      2 client connect(s) succeeded
2022.04.14 08:56:49 LOG7[1]:      0 client renegotiation(s) requested
2022.04.14 08:56:49 LOG7[1]:      0 session reuse(s)
```

Both connects performed tls handshake.

### Stunnel config

This stunnel config is not exactly the same to the stunnel log wrt port, but in general they are the same

```output
fips = no
foreground = yes
socket = l:SO_REUSEADDR=yes
socket = a:SO_BINDTODEVICE=lo
debug = debug
output = /var/log/amazon/efs/fs-12345678.home.ec2-user.efs2.20143.stunnel.log
[efs]
client = yes
accept = 127.0.0.1:20143
connect = fs-12345678.efs.us-east-1.amazonaws.com:2049
sslVersion = TLSv1.2
renegotiation = no
TIMEOUTbusy = 20
TIMEOUTclose = 0
TIMEOUTidle = 70
delay = yes
verify = 2
CAfile = /etc/amazon/efs/efs-utils.crt
cert = /var/run/efs/fs-12345678.home.ec2-user.efs2.20143+/certificate.pem
key = /etc/amazon/efs/privateKey.pem
checkHost = fs-c8d17e7d.efs.us-east-1.amazonaws.com
libwrap = no
```

### Packet capture

```output
Local: 127.0.0.1:20415

2022.04.14 08:56:49 LOG5[0]: Service [efs] accepted connection from 127.0.0.1:59168
2022.04.14 08:56:49 LOG5[0]: Service [efs] connected remote server from 172.31.84.76:33886

2022.04.14 08:56:49 LOG5[1]: Service [efs] accepted connection from 127.0.0.1:59172
2022.04.14 08:56:49 LOG5[1]: Service [efs] connected remote server from 172.31.84.76:33890

3   2022-04-14 08:56:49.343417  127.0.0.1   127.0.0.1   TCP 76  59168 → 20415 [SYN] Seq=0 Win=65495 Len=0 MSS=65495 SACK_PERM=1 TSval=1722018352 TSecr=0 WS=128
4   2022-04-14 08:56:49.343428  127.0.0.1   127.0.0.1   TCP 76  20415 → 59168 [SYN, ACK] Seq=0 Ack=1 Win=65483 Len=0 MSS=65495 SACK_PERM=1 TSval=1722018352 TSecr=1722018352 WS=128
5   2022-04-14 08:56:49.343438  127.0.0.1   127.0.0.1   TCP 68  59168 → 20415 [ACK] Seq=1 Ack=1 Win=65536 Len=0 TSval=1722018352 TSecr=1722018352
6   2022-04-14 08:56:49.343460  127.0.0.1   127.0.0.1   TCP 68  59168 → 20415 [FIN, ACK] Seq=1 Ack=1 Win=65536 Len=0 TSval=1722018352 TSecr=1722018352
7   2022-04-14 08:56:49.344683  127.0.0.1   127.0.0.1   TCP 68  20415 → 59168 [ACK] Seq=1 Ack=2 Win=65536 Len=0 TSval=1722018354 TSecr=1722018352

8   2022-04-14 08:56:49.347753  172.31.84.76    172.31.85.253   TCP 76  33886 → 2049 [SYN] Seq=0 Win=62727 Len=0 MSS=8961 SACK_PERM=1 TSval=295266735 TSecr=0 WS=128
9   2022-04-14 08:56:49.348775  172.31.85.253   172.31.84.76    TCP 76  2049 → 33886 [SYN, ACK] Seq=0 Ack=1 Win=26244 Len=0 MSS=8645 SACK_PERM=1 TSval=2888698147 TSecr=295266735 WS=128
10  2022-04-14 08:56:49.348787  172.31.84.76    172.31.85.253   TCP 68  33886 → 2049 [ACK] Seq=1 Ack=1 Win=62848 Len=0 TSval=295266736 TSecr=2888698147
11  2022-04-14 08:56:49.349121  172.31.84.76    172.31.85.253   TLSv1.2 299 Client Hello
12  2022-04-14 08:56:49.349543  172.31.85.253   172.31.84.76    TCP 68  2049 → 33886 [ACK] Seq=1 Ack=232 Win=27392 Len=0 TSval=2888698147 TSecr=295266736
13  2022-04-14 08:56:49.352535  172.31.85.253   172.31.84.76    TLSv1.2 5506    Server Hello, Certificate[Packet size limited during capture]
14  2022-04-14 08:56:49.352545  172.31.84.76    172.31.85.253   TCP 68  33886 → 2049 [ACK] Seq=232 Ack=5439 Win=57472 Len=0 TSval=295266739 TSecr=2888698150

15  2022-04-14 08:56:49.358652  127.0.0.1   127.0.0.1   TCP 76  59172 → 20415 [SYN] Seq=0 Win=65495 Len=0 MSS=65495 SACK_PERM=1 TSval=1722018367 TSecr=0 WS=128
16  2022-04-14 08:56:49.358661  127.0.0.1   127.0.0.1   TCP 76  20415 → 59172 [SYN, ACK] Seq=0 Ack=1 Win=65483 Len=0 MSS=65495 SACK_PERM=1 TSval=1722018368 TSecr=1722018367 WS=128
17  2022-04-14 08:56:49.358669  127.0.0.1   127.0.0.1   TCP 68  59172 → 20415 [ACK] Seq=1 Ack=1 Win=65536 Len=0 TSval=1722018368 TSecr=1722018368
18  2022-04-14 08:56:49.359775  127.0.0.1   127.0.0.1   NFS 112 V4 NULL Call (Reply In 43)
19  2022-04-14 08:56:49.359780  127.0.0.1   127.0.0.1   TCP 68  20415 → 59172 [ACK] Seq=1 Ack=45 Win=65536 Len=0 TSval=1722018369 TSecr=1722018369

20  2022-04-14 08:56:49.361340  172.31.84.76    172.31.85.253   TCP 76  33890 → 2049 [SYN] Seq=0 Win=62727 Len=0 MSS=8961 SACK_PERM=1 TSval=295266748 TSecr=0 WS=128
21  2022-04-14 08:56:49.362399  172.31.85.253   172.31.84.76    TCP 76  2049 → 33890 [SYN, ACK] Seq=0 Ack=1 Win=26244 Len=0 MSS=8645 SACK_PERM=1 TSval=501946609 TSecr=295266748 WS=128
22  2022-04-14 08:56:49.362411  172.31.84.76    172.31.85.253   TCP 68  33890 → 2049 [ACK] Seq=1 Ack=1 Win=62848 Len=0 TSval=295266749 TSecr=501946609

23  2022-04-14 08:56:49.362621  172.31.84.76    172.31.85.253   TLSv1.2 299 Client Hello
24  2022-04-14 08:56:49.362983  172.31.85.253   172.31.84.76    TCP 68  2049 → 33890 [ACK] Seq=1 Ack=232 Win=27392 Len=0 TSval=501946610 TSecr=295266749
25  2022-04-14 08:56:49.366595  172.31.85.253   172.31.84.76    TLSv1.2 5506    Server Hello, Certificate[Packet size limited during capture]
26  2022-04-14 08:56:49.366603  172.31.84.76    172.31.85.253   TCP 68  33890 → 2049 [ACK] Seq=232 Ack=5439 Win=57472 Len=0 TSval=295266753 TSecr=501946614


33886, this connection just disconnected after the handshake
27  2022-04-14 08:56:49.369998  172.31.84.76    172.31.85.253   TLSv1.2 1674    Certificate, Client Key Exchange, Certificate Verify, Change Cipher Spec, Encrypted Handshake Message
28  2022-04-14 08:56:49.371771  172.31.85.253   172.31.84.76    TLSv1.2 119 Change Cipher Spec, Encrypted Handshake Message
29  2022-04-14 08:56:49.371781  172.31.84.76    172.31.85.253   TCP 68  33886 → 2049 [ACK] Seq=1838 Ack=5490 Win=57472 Len=0 TSval=295266759 TSecr=2888698170
# This "alert" is used in SSL/TLS for notifying to close the connection. So it's quit normal to see "Encrypted Alert" at the end of a SSL/TLS session. Normally when there is no more data to # send, the sender sends this TLS Alert.
30  2022-04-14 08:56:49.373626  172.31.84.76    172.31.85.253   TLSv1.2 99  Encrypted Alert
31  2022-04-14 08:56:49.374406  172.31.85.253   172.31.84.76    TLSv1.2 99  Encrypted Alert
32  2022-04-14 08:56:49.374415  172.31.84.76    172.31.85.253   TCP 68  33886 → 2049 [ACK] Seq=1869 Ack=5521 Win=57472 Len=0 TSval=295266761 TSecr=2888698172
33  2022-04-14 08:56:49.374494  172.31.85.253   172.31.84.76    TCP 68  2049 → 33886 [RST, ACK] Seq=5521 Ack=1869 Win=30592 Len=0 TSval=2888698172 TSecr=295266760
34  2022-04-14 08:56:49.374550  127.0.0.1   127.0.0.1   TCP 68  20415 → 59168 [FIN, ACK] Seq=1 Ack=2 Win=65536 Len=0 TSval=1722018383 TSecr=1722018352
35  2022-04-14 08:56:49.374557  127.0.0.1   127.0.0.1   TCP 68  59168 → 20415 [ACK] Seq=2 Ack=2 Win=65536 Len=0 TSval=1722018383 TSecr=1722018383
36  2022-04-14 08:56:49.374795  172.31.85.253   172.31.84.76    TCP 56  2049 → 33886 [RST] Seq=5521 Win=0 Len=0

33890, this is the one that transfer the application data
37  2022-04-14 08:56:49.379888  172.31.84.76    172.31.85.253   TLSv1.2 1674    Certificate, Client Key Exchange, Certificate Verify, Change Cipher Spec, Encrypted Handshake Message
38  2022-04-14 08:56:49.381411  172.31.85.253   172.31.84.76    TLSv1.2 119 Change Cipher Spec, Encrypted Handshake Message
39  2022-04-14 08:56:49.381420  172.31.84.76    172.31.85.253   TCP 68  33890 → 2049 [ACK] Seq=1838 Ack=5490 Win=57472 Len=0 TSval=295266768 TSecr=501946628
40  2022-04-14 08:56:49.382242  172.31.84.76    172.31.85.253   TLSv1.2 141 Application Data
41  2022-04-14 08:56:49.382874  172.31.85.253   172.31.84.76    TLSv1.2 125 Application Data
42  2022-04-14 08:56:49.382883  172.31.84.76    172.31.85.253   TCP 68  33890 → 2049 [ACK] Seq=1911 Ack=5547 Win=57472 Len=0 TSval=295266770 TSecr=501946630

20145 - 59172
43  2022-04-14 08:56:49.382937  127.0.0.1   127.0.0.1   NFS 96  V4 NULL Reply (Call In 18)
44  2022-04-14 08:56:49.382942  127.0.0.1   127.0.0.1   TCP 68  59172 → 20415 [ACK] Seq=45 Ack=29 Win=65536 Len=0 TSval=1722018392 TSecr=1722018392
45  2022-04-14 08:56:49.385593  127.0.0.1   127.0.0.1   NFS 352 V4 Call (Reply In 50) EXCHANGE_ID
46  2022-04-14 08:56:49.385598  127.0.0.1   127.0.0.1   TCP 68  20415 → 59172 [ACK] Seq=29 Ack=329 Win=65280 Len=0 TSval=1722018394 TSecr=1722018394
47  2022-04-14 08:56:49.385632  172.31.84.76    172.31.85.253   TLSv1.2 381 Application Data

```

When the 30886 connect finished I can see following in stunnel log

```output
2022.04.14 08:56:49 LOG6[0]: Read socket closed (readsocket)
2022.04.14 08:56:49 LOG7[0]: Sending close_notify alert
2022.04.14 08:56:49 LOG7[0]: TLS alert (write): warning: close notify
2022.04.14 08:56:49 LOG6[0]: SSL_shutdown successfully sent close_notify alert
2022.04.14 08:56:49 LOG7[0]: TLS alert (read): warning: close notify
2022.04.14 08:56:49 LOG6[0]: TLS closed (SSL_read)
2022.04.14 08:56:49 LOG7[0]: Sent socket write shutdown
2022.04.14 08:56:49 LOG5[0]: Connection closed: 0 byte(s) sent to TLS, 0 byte(s) sent to socket
2022.04.14 08:56:49 LOG7[0]: Remote descriptor (FD=11) closed
2022.04.14 08:56:49 LOG7[0]: Local descriptor (FD=3) closed
2022.04.14 08:56:49 LOG7[0]: Service [efs] finished (1 left)
```

### Server configuration

Will server configuration impact the behavior of handshake?

**Comment by kaduk** [comment]
It sure does look like the client is just making two connection attempts in parallel (and thanks for the update about both succeeding vs. just one in the original paste).  Often this would happen to race IPv4 and IPv6 attempts, but the packet capture seems to show both as using IPv4, so I don't have many ideas about why it is happening that way.
A packet capture with the full contents of the two ClientHellos might help ascertain if there are differences at the TLS (rather than IP) layer, but I also don't know how much effort you want to put into understanding what's going on here.

**Comment by Cappuccinuo** [comment]
Thanks @kaduk for the analysis,

Can you share more details about how to perform the packet capture for the full contents of the TLS connection? Is that still using `tcpdump` command?

**Comment by kaduk** [comment]
Yes, `tcpdump` will do it.
I usually just use `tcpdump -w /tmp/output.pcap ...` and use wirewhark to examine the dump.
But something like `tcpdump -x` would show payloads.  (I forget whether the `tcpdump -vvv` output would be verbose enough for this scenario.)

**Comment by Cappuccinuo** [comment]
I think the reason why we saw two connections, is because our nfs mount triggered another connection on the stunnel. 

The first connection is established by stunnel itself, which only perform tls handshake without performing any operation, since this stunnel connect is not triggered by a real mount command. This connect is closed later.

The second connection is established by mount call, which perform not only tls handshake, but also send application data, and establish real connection with server side. This connect will remain alive.

Close this question.
