### ISSUE TITLE
Why is the HTTPS server using RSA 512bits disconnect in ephemeral cipher(ECDHE_RSA)?

### ISSUE THREAD

**Issue by Ho-youngPark** [openssl/openssl#2751]
Hi, 

I'm developing HTTPS server using openssl 1.0.2d.

In TLS1.2 that HTTPS server use key of RSA 512bits, the HTTPS server is disconnected while performing a TLS handshake(server Certificate message → Server key exchange message) with [TLS_ECDHE_RSA_WITH_AES_256_GCM_SHA384]

       Client IP : 10.1.31.35
       Server IP : 10.1.31.29
No.     Time           Source                Destination           Protocol Length Info
2142 29.413255      10.1.31.35            10.1.31.29            TCP      66     7679 → 443 [SYN] Seq=0 Win=8192 Len=0 MSS=1460 WS=256 SACK_PERM=1
2143 29.413606      10.1.31.29            10.1.31.35            TCP      62     443 → 7679 [SYN, ACK] Seq=0 Ack=1 Win=31000 Len=0 MSS=1460 WS=1
2144 29.413721      10.1.31.35            10.1.31.29            TCP      54     7679 → 443 [ACK] Seq=1 Ack=1 Win=65536 Len=0
2145 29.414562      10.1.31.35            10.1.31.29            TLSv1.2  237    Client Hello
2146 29.441999      10.1.31.29            10.1.31.35            TLSv1.2  693    Server Hello, Certificate
2147 29.442250      10.1.31.29            10.1.31.35            TCP      60     443 → 7679 [FIN, ACK] Seq=640 Ack=184 Win=31000 Len=0
2148 29.442311      10.1.31.35            10.1.31.29            TCP      54     7679 → 443 [ACK] Seq=184 Ack=641 Win=65024 Len=0
2149 29.442548      10.1.31.35            10.1.31.29            TCP      54     7679 → 443 [FIN, ACK] Seq=184 Ack=641 Win=65024 Len=0
2150 29.442859      10.1.31.29            10.1.31.35            TCP      60     443 → 7679 [ACK] Seq=641 Ack=185 Win=31000 Len=0

The ssl3_send_server_key_exchange()function seems to disconnect because of the if statement((1994Line)) in the source below.
`if (!EVP_SignFinal(&md_ctx, &(p[2]),
                                   (unsigned int *)&i, pkey)) {
SSLerr(SSL_F_SSL3_SEND_SERVER_KEY_EXCHANGE, ERR_LIB_EVP);
goto err;
}
`

In OpenSSL origin code(1.0.2j), I tried the following command

>OpenSSL>s_server –key rsa512.pem –cert cert512.cer –accept 443 –www

>OpenSSL>s_client –connect <ipaddress:443> -cipher ECDHE-RSA-AES256-GCM-SHA384

and I get the following error.
`11716:error:04075070:rsa routines:RSA_sign:digest too big for rsa key:.\crypto\rsa\rsa_sign.c:122:
11716:error:1409B006:SSL routines:ssl3_send_server_key_exchange:EVP lib:.\ssl\s3_srvr.c:2002:
`

**Question 1) Why is the HTTPS server using RSA 512bits disconnect in ephemeral cipher(ECDHE_RSA)?

Question 2) Is there any way for an HTTPS server using RSA 512bits to succeed in a handshake with [TLS_ECDHE_RSA_WITH_AES_256_GCM_SHA384]? If so, please let me know how.**

**Comment by richsalz** [comment]
That keysize is too small.  It is a security weakness to use a 512 bit key.  If you absolutely have to do it, you might have to edit the openssl source.
