### DISCUSSION TITLE
Best Practice for Performing TLS 1.2 Renegotiation Using OpenSSL

### DISCUSSION THREAD

**Discussion by toodaka** [openssl/openssl#29058] [Q&A]
### Goal

I’m trying to perform a TLS 1.2 renegotiation (re-handshake) while keeping the existing session alive.

### Issue

When I use SSL_renegotiate() to trigger a renegotiation, it seems that both the client and the server must call SSL_renegotiate() almost simultaneously, otherwise it fails.

Current Implementation (Simplified Example)

Client:
```
int OpenSSLMan::Send(LPCTSTR lpszData, DWORD dwSendLen)
{
	if (m_reNegoSignal == true) {
		const char* signal = "RENEGOTIATE";
		nRet = SSL_write(m_pSSL, signal, static_cast<int>(strlen(signal)));

		if (SSL_renegotiate(m_pSSL) != 1) {
			printf("SSL_renegotiate failed\n");
		} else {
			m_reNegoSignal = false;
		}
	}

	nRet = SSL_write(m_pSSL, lpszData, dwSendLen);
	return nRet;
}
```
Server:
```
int OpenSSLMan::ReceiveDataSecure(LPSTR lpszData, DWORD dwBufSize, DWORD* pdwReceivedLen)
{
	int nRet;
	nRet = SSL_read(m_pSSL, lpszData, dwBufSize);

	if (strcmp(lpszData, "RENEGOTIATE") == 0) {
		if (SSL_renegotiate(m_pSSL) != 1) {
			printf("SSL_renegotiate failed\n");
		}
	}

	return nRet;
}
```
### Background

Many online examples seem to perform renegotiation without sending any explicit signal between client and server.
However, after referring to this Stack Overflow thread:
https://stackoverflow.com/questions/28944294/how-to-perform-a-rehandshake-renegotiation-with-openssl-api

I tried using SSL_do_handshake(), but it returned -1.
As a result, I implemented the above logic, sending "RENEGOTIATE" as a trigger message.

### Questions

Is it necessary for both client and server to call SSL_renegotiate() almost at the same time in order to succeed?

What is the recommended or best-practice way to perform TLS 1.2 renegotiation with OpenSSL?

If coordination is required, is there a better way to detect a renegotiation request (e.g. using SSL_renegotiate_pending() or SSL_get_state())?

### Environment

OpenSSL version: 3.3.0

Protocol: TLS 1.2

**Comment by mattcaswell** [comment]
Since version 3.0 client initiated renegotiation is disabled by default. Server initiated renegotiation is allowed.

It should be sufficient to just call `SSL_renegotiate` on the server side. Once the hello request message has arrived on the client side it should be processed automatically by the client the next time you call `SSL_read`/`SSL_peek` etc and the renegotiation will proceed as normal.

This is probably why you are seeing this timing issue if you are attempting to start the renegotiation on both sides at the same time.  If the clients "client hello" message arrives at the server before it has sent its "hello request" message then it will fail. As noted above you should not need to call `SSL_renegotiate` on the client side at all.

Alternatively, you can allow client initiated renegotiation by setting the option `SSL_OP_ALLOW_CLIENT_RENEGOTIATION` (via `SSL_CTX_set_options` or `SSL_set_options`) on the server side. If the server is configured in this way then you can just call `SSL_renegotiate` on the client side (without needing to call it on the server side....just call `SSL_read`/`SSL_peek` etc as normal and it will be processed).

**Reply by toodaka** [reply]
hi mattcaswell san

Thank you very much!
After setting SSL_OP_ALLOW_CLIENT_RENEGOTIATION, I was able to successfully perform renegotiation initiated by the client.

However, when I try to initiate renegotiation from the server side, the client’s SSL_read() fails with an error.
Could you please advise how to resolve this issue, or what might be causing it?

As you suggested, I have disabled client-initiated renegotiation to avoid collisions, and now only the server attempts to trigger renegotiation.

**Comment by mattcaswell** [comment]
> However, when I try to initiate renegotiation from the server side, the client’s SSL_read() fails with an error.
Could you please advise how to resolve this issue, or what might be causing it?

Are you using a blocking or non-blocking socket?
What error are you seeing?
Do you call `SSL_get_error()` after the `SSL_read()` failure?

When the server sends its "HelloRequest" message to initiate the renegotiation, a call to `SSL_read` on the client side will cause it to process that message, but it will not yield any application data. So typically this means that `SSL_read` returns with a temporary error and `SSL_get_error` returns `SSL_ERROR_WANT_READ` - meaning it has no application data yet and you should call it again.

**Reply by toodaka** [reply]
mattcaswell san

Thank you very much for your quick response!
Please see my answers below.


>Are you using a blocking or non-blocking socket?

We are using a blocking socket.


>What error are you seeing?

We observed the following error:
- SSL_get_error() returned 1 (SSL_ERROR_SSL)
- ERR_get_error() returned 0A000438:SSL routines::tlsv1 alert internal error

>Do you call SSL_get_error() after the SSL_read() failure?

Yes. We call SSL_get_error() right after the SSL_read() failure, as shown in the following sample code:


```
	nRet = SSL_read(m_pSSL, lpszData, dwBufSize);

	if (nRet <= 0) {
		int error_code = SSL_get_error(m_pSSL, nRet);

		switch (error_code) {
		case SSL_ERROR_NONE:
#ifdef __DETAILTRACE__
			OutputDebugString(_T("COpenSSLMan::ReceiveDataSecure() - ok\n"));
#endif
			break;

		case SSL_ERROR_ZERO_RETURN:
			OutputDebugString(_T("COpenSSLMan::ReceiveDataSecure() - connection closed (close_notify)\n"));
			break;

		case SSL_ERROR_WANT_READ:
			OutputDebugString(_T("COpenSSLMan::ReceiveDataSecure() - want read\n"));
			break;

		case SSL_ERROR_WANT_WRITE:
			OutputDebugString(_T("COpenSSLMan::ReceiveDataSecure() - want write\n"));
			break;

		case SSL_ERROR_SSL:
		case SSL_ERROR_SYSCALL:
		default:
		{
			unsigned long e;
			while ((e = ERR_get_error()) != 0) {
				char err_buf[256];
				ERR_error_string_n(e, err_buf, sizeof(err_buf));

				OutputDebugString(err_buf);
				OutputDebugString("\n");
			}
		}
		break;
		}
	}
```

**Reply by mattcaswell** [reply]
> SSL_get_error() returned 1 (SSL_ERROR_SSL)
ERR_get_error() returned 0A000438:SSL routines::tlsv1 alert internal error

So you see this on the client side right?

This actually means that the server encountered an error and sent an internal_error alert to the client.

So did something fail on the server side? You should check the OpenSSL error stack there.

**Reply by toodaka** [reply]
Thank you for your question. Here’s the current situation:

On the server side, SSL_Read returns the following error:

>error:0A000115:SSL routines::session id context uninitialized

According to information from ChatGPT, it is necessary to explicitly set the session ID using SSL_CTX_set_session_id_context on the server side.
After trying this, the server SSL_Read now returns the following errors:

>OpenSSL Error: error:0A00010B:SSL routines::wrong version number
>OpenSSL Error: error:0A000139:SSL routines::record layer failure

Meanwhile, the client SSL_Read returns SSL_ERROR_SYSCALL, and WSAGetLastError() reports:
>10060 (0x0000274C)

Given this situation, what is the recommended way to resolve the SSL_Read errors on both server and client?

Also, I set the SSL_CTX_set_session_id_context only once on the server side as follows:
```
const unsigned char sid_ctx[] = "MyServerSessionContext";
if (!SSL_CTX_set_session_id_context(ctx, sid_ctx, sizeof(sid_ctx) - 1)) {
}
```

**Reply by mattcaswell** [reply]
Please can you clarify the calls that you are making on the server and the client side.

If I understand correctly:

You call SSL_renegotiate() on the server side. Does it succeed?
Do you then call SSL_read()/SSL_write() or similar on the server? Does this call succeed?

On the client side you are calling SSL_read after the server has requested renegotiation? Does this succeed?

I need to understand the sequence of SSL_read/SSL_write/SSL_renegotiate calls on the client and server and whether they succeed or not, and what point you see the errors you indicate above.

**Reply by toodaka** [reply]
>You call SSL_renegotiate() on the server side. Does it succeed?

Yes, it succeeds.


>Do you then call SSL_read()/SSL_write() or similar on the server? Does this call succeed?
>On the client side you are calling SSL_read after the server has requested renegotiation? Does this succeed?
>I need to understand the sequence of SSL_read/SSL_write/SSL_renegotiate calls on the client and server and whether they succeed or not, and what point you see the errors you indicate above.

Yes, after renegotiation, both the client and the server call SSL_read() and SSL_write(). However, these calls fail.
The logs with and without SSL_CTX_set_session_id_context are as follows:


### ・Without SSL_CTX_set_session_id_context
[Server]
[2025-11-11 08:59:29.085] SSL_renegotiate succeeded
[2025-11-11 08:59:29.091] SSL_read succeseed
[2025-11-11 08:59:29.091] SSL_read succeseed
[2025-11-11 08:59:29.092] SSL_read succeseed
[2025-11-11 08:59:29.092] SSL_read succeseed
[2025-11-11 08:59:29.092] SSL_read succeseed
[2025-11-11 08:59:29.092] SSL_read succeseed
[2025-11-11 08:59:29.092] SSL_read succeseed
[2025-11-11 08:59:29.092] SSL_read succeseed
[2025-11-11 08:59:29.093] SSL_read succeseed
[2025-11-11 08:59:29.093] SSL_read succeseed
[2025-11-11 08:59:29.093] SSL_read succeseed
[2025-11-11 08:59:29.093] SSL_read succeseed
[2025-11-11 08:59:29.093] SSL_read succeseed
[2025-11-11 08:59:29.093] SSL_read succeseed
[2025-11-11 08:59:29.093] SSL_read succeseed
[2025-11-11 08:59:29.094] SSL_read succeseed
[2025-11-11 08:59:29.094] SSL_read succeseed
[2025-11-11 08:59:29.095] SSL_read OpenSSL Error: error:0A000115:SSL routines::session id context uninitialized
[2025-11-11 08:59:29.095] SSL_write OpenSSL Error: error:0A0C0103:SSL routines::internal error

[Client]
[2025-11-11 08:59:29.072] SSL_write succeseed
[2025-11-11 08:59:29.082] SSL_read succeseed
[2025-11-11 08:59:29.087] SSL_write succeseed
[2025-11-11 08:59:29.097] SSL_read succeseed
[2025-11-11 08:59:29.107] SSL_write succeseed
[2025-11-11 08:59:29.111] SSL_read succeseed
[2025-11-11 08:59:29.127] SSL_write succeseed
[2025-11-11 08:59:29.127] SSL_read succeseed
[2025-11-11 08:59:29.137] SSL_write succeseed
[2025-11-11 08:59:29.147] SSL_read succeseed
[2025-11-11 08:59:29.157] SSL_write succeseed
[2025-11-11 08:59:29.157] SSL_read succeseed
[2025-11-11 08:59:29.172] SSL_write succeseed
[2025-11-11 08:59:29.178] SSL_read succeseed
[2025-11-11 08:59:29.189] SSL_write succeseed
[2025-11-11 08:59:29.189] SSL_read succeseed
[2025-11-11 08:59:29.208] SSL_write succeseed
[2025-11-11 08:59:29.208] SSL_read succeseed
[2025-11-11 08:59:29.218] SSL_write succeseed
[2025-11-11 08:59:29.228] SSL_read OpenSSL Error: error:0A000438:SSL routines::tlsv1 alert internal error
[2025-11-11 08:59:29.501] SSL_read WSA Error: 0 (0x00000000)
[2025-11-11 08:59:29.501] SSL_write  OPENSSL Error: error:0A0C0103:SSL routines::internal error
[2025-11-11 08:59:30.498] SSL_read OpenSSL Error: error:0A0C0103:SSL routines::internal error


### ・With SSL_CTX_set_session_id_context
[Server]
[2025-11-11 09:15:39.596] SSL_renegotiate succeeded
[2025-11-11 09:15:39.606] SSL_read succeseed
[2025-11-11 09:15:39.607] SSL_read succeseed
[2025-11-11 09:15:39.607] SSL_read succeseed
[2025-11-11 09:15:39.607] SSL_read succeseed
[2025-11-11 09:15:39.607] SSL_read succeseed
[2025-11-11 09:15:39.607] SSL_read succeseed
[2025-11-11 09:15:39.607] SSL_read succeseed
[2025-11-11 09:15:39.608] SSL_read succeseed
[2025-11-11 09:15:39.608] SSL_read succeseed
[2025-11-11 09:15:39.608] SSL_read succeseed
[2025-11-11 09:15:39.608] SSL_read succeseed
[2025-11-11 09:15:39.608] SSL_read succeseed
[2025-11-11 09:15:39.608] SSL_read succeseed
[2025-11-11 09:15:39.608] SSL_read succeseed
[2025-11-11 09:15:39.608] SSL_read succeseed
[2025-11-11 09:15:39.608] SSL_read succeseed
[2025-11-11 09:15:39.609] SSL_read succeseed
[2025-11-11 09:16:09.621] SSL_read OpenSSL Error: error:0A00010B:SSL routines::wrong version number
[2025-11-11 09:16:09.622] SSL_read OpenSSL Error: error:0A000139:SSL routines::record layer failure
[2025-11-11 09:16:09.623] SSL_write OpenSSL Error: error:0A0000C6:SSL routines::packet length too long
[2025-11-11 09:16:09.623] SSL_write OpenSSL Error: error:0A000139:SSL routines::record layer failure

[Client]
[2025-11-11 09:15:39.693] SSL_read succeseed
[2025-11-11 09:15:39.706] SSL_write succeseed
[2025-11-11 09:15:39.709] SSL_read succeseed
[2025-11-11 09:15:39.723] SSL_write succeseed
[2025-11-11 09:15:39.726] SSL_read succeseed
[2025-11-11 09:15:39.739] SSL_write succeseed
[2025-11-11 09:16:09.753] SSL_read WSA Error: 10060 (0x0000274C)
[2025-11-11 09:16:09.756] SSL_write  OPENSSL Error: error:0A0000CD:SSL routines::invalid alert
[2025-11-11 09:16:09.784] SSL_read WSA Error: 10054 (0x00002746)
[2025-11-11 09:16:09.785] SSL_write WSA Error: 10054 (0x00002746)
[2025-11-11 09:16:10.787] SSL_read WSA Error: 10054 (0x00002746)
[2025-11-11 09:16:10.788] SSL_write WSA Error: 10054 (0x00002746)
[2025-11-11 09:16:11.789] SSL_read WSA Error: 10054 (0x00002746)
[2025-11-11 09:16:11.789] SSL_write WSA Error: 10054 (0x00002746)

**Reply by toodaka** [reply]
Hi @mattcaswell ,

I just wanted to gently follow up on this question.
Is there any update or additional information available at this point?

Thank you for your time.

**Reply by mattcaswell** [reply]
> [2025-11-11 09:16:09.621] SSL_read OpenSSL Error: error:0A00010B:SSL routines::wrong version number

This error happens when the server receives a record with an invalid header. This should not happen during normal operation. It suggests some kind of corruption of the record has occurred. Are you able to capture a pcap trace of this communication?

**Reply by DWota** [reply]
Hi @mattcaswell ,
I'm replying to you on behalf of toodaka.
I captured the packets before and after the issue occurred using Wireshark.
Do you see anything that looks problematic?

// summary

````
No	Time	Source	Destination	Protocol	Length	Info
277	60.868063	127.0.0.1	127.0.0.1	TCP	44	5107 → 62342 [ACK] Seq=7675 Ack=7935 Win=2153216 Len=0
278	90.868848	127.0.0.1	127.0.0.1	TCP	45	[TCP Keep-Alive] 62342 → 5107 [ACK] Seq=7934 Ack=7675 Win=319744 Len=1
279	90.868894	127.0.0.1	127.0.0.1	TCP	56	[TCP Keep-Alive ACK] 5107 → 62342 [ACK] Seq=7675 Ack=7935 Win=2153216 Len=0 SLE=7934 SRE=7935
280	90.917416	127.0.0.1	127.0.0.1	TLSv1.2	160	Client Hello
281	90.917479	127.0.0.1	127.0.0.1	TCP	44	5107 → 62342 [ACK] Seq=7675 Ack=8051 Win=2153216 Len=0
282	90.917666	127.0.0.1	127.0.0.1	TLSv1.2	75	Encrypted Alert
283	90.917717	127.0.0.1	127.0.0.1	TCP	44	62342 → 5107 [ACK] Seq=8051 Ack=7706 Win=319744 Len=0
284	90.917799	127.0.0.1	127.0.0.1	TLSv1.2	51	Alert (Level: Fatal, Description: Unexpected Message)
285	90.917858	127.0.0.1	127.0.0.1	TCP	44	5107 → 62342 [ACK] Seq=7706 Ack=8058 Win=2153216 Len=0
````
// detail

````
Frame 277: Packet, 44 bytes on wire (352 bits), 44 bytes captured (352 bits) on interface \Device\NPF_Loopback, id 0
Null/Loopback
    Family: IP (2)
Internet Protocol Version 4, Src: 127.0.0.1, Dst: 127.0.0.1
Transmission Control Protocol, Src Port: 5107, Dst Port: 62342, Seq: 7675, Ack: 7935, Len: 0
-----------------
Frame 278: Packet, 45 bytes on wire (360 bits), 45 bytes captured (360 bits) on interface \Device\NPF_Loopback, id 0
Null/Loopback
    Family: IP (2)
Internet Protocol Version 4, Src: 127.0.0.1, Dst: 127.0.0.1
    0100 .... = Version: 4
    .... 0101 = Header Length: 20 bytes (5)
    Differentiated Services Field: 0x00 (DSCP: CS0, ECN: Not-ECT)
    Total Length: 41
    Identification: 0xca2a (51754)
    010. .... = Flags: 0x2, Don't fragment
    ...0 0000 0000 0000 = Fragment Offset: 0
    Time to Live: 128
    Protocol: TCP (6)
    Header Checksum: 0x32a2 [validation disabled]
    [Header checksum status: Unverified]
    Source Address: 127.0.0.1
    Destination Address: 127.0.0.1
    [Stream index: 0]
Transmission Control Protocol, Src Port: 62342, Dst Port: 5107, Seq: 7934, Ack: 7675, Len: 1
Data (1 byte)
-----------------
Frame 279: Packet, 56 bytes on wire (448 bits), 56 bytes captured (448 bits) on interface \Device\NPF_Loopback, id 0
Null/Loopback
    Family: IP (2)
Internet Protocol Version 4, Src: 127.0.0.1, Dst: 127.0.0.1
    0100 .... = Version: 4
    .... 0101 = Header Length: 20 bytes (5)
    Differentiated Services Field: 0x00 (DSCP: CS0, ECN: Not-ECT)
    Total Length: 52
    Identification: 0xca2b (51755)
    010. .... = Flags: 0x2, Don't fragment
    ...0 0000 0000 0000 = Fragment Offset: 0
    Time to Live: 128
    Protocol: TCP (6)
    Header Checksum: 0x3296 [validation disabled]
    [Header checksum status: Unverified]
    Source Address: 127.0.0.1
    Destination Address: 127.0.0.1
    [Stream index: 0]
Transmission Control Protocol, Src Port: 5107, Dst Port: 62342, Seq: 7675, Ack: 7935, Len: 0
-----------------
Frame 280: Packet, 160 bytes on wire (1280 bits), 160 bytes captured (1280 bits) on interface \Device\NPF_Loopback, id 0
Null/Loopback
    Family: IP (2)
Internet Protocol Version 4, Src: 127.0.0.1, Dst: 127.0.0.1
    0100 .... = Version: 4
    .... 0101 = Header Length: 20 bytes (5)
    Differentiated Services Field: 0x00 (DSCP: CS0, ECN: Not-ECT)
    Total Length: 156
    Identification: 0xca2c (51756)
    010. .... = Flags: 0x2, Don't fragment
    ...0 0000 0000 0000 = Fragment Offset: 0
    Time to Live: 128
    Protocol: TCP (6)
    Header Checksum: 0x322d [validation disabled]
    [Header checksum status: Unverified]
    Source Address: 127.0.0.1
    Destination Address: 127.0.0.1
    [Stream index: 0]
Transmission Control Protocol, Src Port: 62342, Dst Port: 5107, Seq: 7935, Ack: 7675, Len: 116
Transport Layer Security
    [Stream index: 0]
    TLSv1.2 Record Layer: Handshake Protocol: Client Hello
        Content Type: Handshake (22)
        Version: TLS 1.0 (0x0301)
        Length: 111
        Handshake Protocol: Client Hello
-----------------
Frame 281: Packet, 44 bytes on wire (352 bits), 44 bytes captured (352 bits) on interface \Device\NPF_Loopback, id 0
Null/Loopback
    Family: IP (2)
Internet Protocol Version 4, Src: 127.0.0.1, Dst: 127.0.0.1
    0100 .... = Version: 4
    .... 0101 = Header Length: 20 bytes (5)
    Differentiated Services Field: 0x00 (DSCP: CS0, ECN: Not-ECT)
    Total Length: 40
    Identification: 0xca2d (51757)
    010. .... = Flags: 0x2, Don't fragment
    ...0 0000 0000 0000 = Fragment Offset: 0
    Time to Live: 128
    Protocol: TCP (6)
    Header Checksum: 0x32a0 [validation disabled]
    [Header checksum status: Unverified]
    Source Address: 127.0.0.1
    Destination Address: 127.0.0.1
    [Stream index: 0]
Transmission Control Protocol, Src Port: 5107, Dst Port: 62342, Seq: 7675, Ack: 8051, Len: 0
-----------------
Frame 282: Packet, 75 bytes on wire (600 bits), 75 bytes captured (600 bits) on interface \Device\NPF_Loopback, id 0
Null/Loopback
    Family: IP (2)
Internet Protocol Version 4, Src: 127.0.0.1, Dst: 127.0.0.1
    0100 .... = Version: 4
    .... 0101 = Header Length: 20 bytes (5)
    Differentiated Services Field: 0x00 (DSCP: CS0, ECN: Not-ECT)
    Total Length: 71
    Identification: 0xca2e (51758)
    010. .... = Flags: 0x2, Don't fragment
    ...0 0000 0000 0000 = Fragment Offset: 0
    Time to Live: 128
    Protocol: TCP (6)
    Header Checksum: 0x3280 [validation disabled]
    [Header checksum status: Unverified]
    Source Address: 127.0.0.1
    Destination Address: 127.0.0.1
    [Stream index: 0]
Transmission Control Protocol, Src Port: 5107, Dst Port: 62342, Seq: 7675, Ack: 8051, Len: 31
Transport Layer Security
    [Stream index: 0]
    TLSv1.2 Record Layer: Encrypted Alert
        Content Type: Alert (21)
        Version: TLS 1.2 (0x0303)
        Length: 26
        Alert Message: Encrypted Alert
-----------------
Frame 283: Packet, 44 bytes on wire (352 bits), 44 bytes captured (352 bits) on interface \Device\NPF_Loopback, id 0
Null/Loopback
    Family: IP (2)
Internet Protocol Version 4, Src: 127.0.0.1, Dst: 127.0.0.1
    0100 .... = Version: 4
    .... 0101 = Header Length: 20 bytes (5)
    Differentiated Services Field: 0x00 (DSCP: CS0, ECN: Not-ECT)
    Total Length: 40
    Identification: 0xca2f (51759)
    010. .... = Flags: 0x2, Don't fragment
    ...0 0000 0000 0000 = Fragment Offset: 0
    Time to Live: 128
    Protocol: TCP (6)
    Header Checksum: 0x329e [validation disabled]
    [Header checksum status: Unverified]
    Source Address: 127.0.0.1
    Destination Address: 127.0.0.1
    [Stream index: 0]
Transmission Control Protocol, Src Port: 62342, Dst Port: 5107, Seq: 8051, Ack: 7706, Len: 0
-----------------
Frame 284: Packet, 51 bytes on wire (408 bits), 51 bytes captured (408 bits) on interface \Device\NPF_Loopback, id 0
Null/Loopback
    Family: IP (2)
Internet Protocol Version 4, Src: 127.0.0.1, Dst: 127.0.0.1
    0100 .... = Version: 4
    .... 0101 = Header Length: 20 bytes (5)
    Differentiated Services Field: 0x00 (DSCP: CS0, ECN: Not-ECT)
    Total Length: 47
    Identification: 0xca30 (51760)
    010. .... = Flags: 0x2, Don't fragment
    ...0 0000 0000 0000 = Fragment Offset: 0
    Time to Live: 128
    Protocol: TCP (6)
    Header Checksum: 0x3296 [validation disabled]
    [Header checksum status: Unverified]
    Source Address: 127.0.0.1
    Destination Address: 127.0.0.1
    [Stream index: 0]
Transmission Control Protocol, Src Port: 62342, Dst Port: 5107, Seq: 8051, Ack: 7706, Len: 7
Transport Layer Security
    [Stream index: 0]
    TLSv1.2 Record Layer: Alert (Level: Fatal, Description: Unexpected Message)
        Content Type: Alert (21)
        Version: TLS 1.0 (0x0301)
        Length: 2
        Alert Message
            Level: Fatal (2)
            Description: Unexpected Message (10)
-----------------
Frame 285: Packet, 44 bytes on wire (352 bits), 44 bytes captured (352 bits) on interface \Device\NPF_Loopback, id 0
Null/Loopback
    Family: IP (2)
Internet Protocol Version 4, Src: 127.0.0.1, Dst: 127.0.0.1
    0100 .... = Version: 4
    .... 0101 = Header Length: 20 bytes (5)
    Differentiated Services Field: 0x00 (DSCP: CS0, ECN: Not-ECT)
    Total Length: 40
    Identification: 0xca31 (51761)
    010. .... = Flags: 0x2, Don't fragment
    ...0 0000 0000 0000 = Fragment Offset: 0
    Time to Live: 128
    Protocol: TCP (6)
    Header Checksum: 0x329c [validation disabled]
    [Header checksum status: Unverified]
    Source Address: 127.0.0.1
    Destination Address: 127.0.0.1
    [Stream index: 0]
Transmission Control Protocol, Src Port: 5107, Dst Port: 62342, Seq: 7706, Ack: 8058, Len: 0
````

**Reply by mattcaswell** [reply]
````
    TLSv1.2 Record Layer: Handshake Protocol: Client Hello
        Content Type: Handshake (22)
        Version: TLS 1.0 (0x0301)
        Length: 111
        Handshake Protocol: Client Hello
````

This looks wrong. This appears to be a plaintext ClientHello message coming from the client to the server. But, for a renegotiation we expect an encrypted ClientHello message.

It looks to me that the client has somehow forgotten that it is doing a renegotiation and has instead initiated a completely new handshake. Meanwhile on the server, it is expecting encrypted messages from the client. It doesn't receive them and therefore the connection fails.

This looks like a client side problem. You should analyse your renegotiation logic in the client side app to confirm that you really are doing a renegotiation and not starting a completely new connection handshake.

**Reply by DWota** [reply]
@mattcaswell ,
In the current implementation, the client side only calls SSL_connect when the socket is initially created, and does not include any other logic to initiate a connection handshake.
(On the server side, SSL_OP_ALLOW_CLIENT_RENEGOTIATION is enabled.)

Before and after the server calls SSL_renegotiate, the client side only performs SSL_read or SSL_write.
When the client receives an SSL_renegotiate request, is it necessary to implement logic on the client side to wait for or handle the renegotiation process?

**Reply by mattcaswell** [reply]
> Before and after the server calls SSL_renegotiate, the client side only performs SSL_read or SSL_write.
> When the client receives an SSL_renegotiate request, is it necessary to implement logic on the client side to wait for or handle the renegotiation process?

Hmm. No, it should not need to do anything. It should just work. Are you correctly handling errors from `SSL_read`/`SSL_write` on the client side? e.g. are you handling a return value of <= 0, and calling `SSL_get_error` in order to handle SSL_ERROR_WANT_READ and SSL_ERROR_WANT_WRITE responses?

**Reply by DWota** [reply]
@mattcaswell ,
After calling SSL_write/SSL_read, I check the return value, and if iRet <= 0, I uniformly call SSL_clear as shown below.
Does this mean that in the cases of SSL_ERROR_WANT_READ and SSL_ERROR_WANT_WRITE, I need to implement processing to retry the operation?

However, when I checked the debug view with this handling in place, the following messages were not output:
OpenSSL::SendData() - want read
OpenSSL::SendData() - want write
OpenSSL::ReceiveData() - want read
OpenSSL::ReceiveData() - want write
```cpp
// ---- Send ----
	…
	int	nRet = 0;

	nRet = SSL_write(m_pSSL, lpszData, dwSendLen);
	
	if (nRet <= 0) {
		int error_code = SSL_get_error(m_pSSL, nRet);

		switch (error_code) {
		case SSL_ERROR_NONE:
#ifdef __DETAILTRACE__		
			OutputDebugString(_T("OpenSSL::SendData() - ok\n"));
#endif
			break;
		case SSL_ERROR_ZERO_RETURN:
			OutputDebugString(_T("OpenSSL::SendData() - connection closed (close_notify)\n"));
			break;
		case SSL_ERROR_WANT_READ:
			OutputDebugString(_T("OpenSSL::SendData() - want read\n"));
			break;
		case SSL_ERROR_WANT_WRITE:
			OutputDebugString(_T("OpenSSL::SendData() - want write\n"));
			break;
		case SSL_ERROR_SSL:
		case SSL_ERROR_SYSCALL:
		default:
		{
			int sys_err = WSAGetLastError();

			// Output OpenSSL error
			unsigned long e;
			bool has_openssl_error = false;
			while ((e = ERR_get_error()) != 0) {
				has_openssl_error = true;
				char err_buf[256];
				ERR_error_string_n(e, err_buf, sizeof(err_buf));

				OutputDebugStringA("OpenSSL Error: ");
				OutputDebugStringA(err_buf);
				OutputDebugStringA("\n");

				WriteLog("SSL_write  OPENSSL Error: %s", err_buf);
			}
			// Output WSA error
			if (!has_openssl_error) {
				char msg[256];
				sprintf_s(msg, sizeof(msg), "SSL_write WSA Error: %d (0x%08X)\n", sys_err, sys_err);
				OutputDebugStringA(msg);

				WriteLog("%s", msg);
			}

			break;
		}
		break;
		}
	}
	else {
		WriteLog("SSL_write succeseed");
	}

	if (nRet <= 0) {
		SSL_clear(m_pSSL);
	}
	return nRet


// ---- Receive ----
	…
	int	nRet;
	if (m_pSSL == NULL) {
		return 0;
	}
	nRet = SSL_read(m_pSSL, lpszData, dwBufSize);

	if (nRet <= 0) {
		int error_code = SSL_get_error(m_pSSL, nRet);

		switch (error_code) {
		case SSL_ERROR_NONE:
#ifdef __DETAILTRACE__
			OutputDebugString(_T("COpenSSLMan::ReceiveData() - ok\n"));
#endif
			break;

		case SSL_ERROR_ZERO_RETURN:
			OutputDebugString(_T("OpenSSL::ReceiveData() - connection closed (close_notify)\n"));
			break;

		case SSL_ERROR_WANT_READ:
			OutputDebugString(_T("OpenSSL::ReceiveData() - want read\n"));
			break;

		case SSL_ERROR_WANT_WRITE:
			OutputDebugString(_T("OpenSSL::ReceiveData() - want write\n"));
			break;

		case SSL_ERROR_SSL:
		case SSL_ERROR_SYSCALL:
		default:
		{
			int sys_err = WSAGetLastError();

			// Output OpenSSL error
			unsigned long e;
			bool has_openssl_error = false;
			while ((e = ERR_get_error()) != 0) {
				has_openssl_error = true;
				char err_buf[256];
				ERR_error_string_n(e, err_buf, sizeof(err_buf));

				OutputDebugStringA("OpenSSL Error: ");
				OutputDebugStringA(err_buf);
				OutputDebugStringA("\n");

				WriteLog("SSL_read OpenSSL Error: %s", err_buf);
			}

			// Output WSA error
			if (!has_openssl_error) {
				char msg[256];
				sprintf_s(msg, sizeof(msg), "SSL_read WSA Error: %d (0x%08X)\n", sys_err, sys_err);
				OutputDebugStringA(msg);

				WriteLog("%s", msg);
			}

			break;
		}
		break;
		}
	}
	else {
		WriteLog("SSL_read succeseed");
	}

	if (nRet <= 0) {
		SSL_clear(m_pSSL);
	}

	return nRet;
```

**Reply by mattcaswell** [reply]
I cannot explain why you do not see the expected debug messages. However this code does look suspect. Yes, you should be retrying the operation in the event of `SSL_ERROR_WANT_READ` or `SSL_ERROR_WANT_WRITE` - you may see these retryable errors occur, even when using a blocking socket. The code looks to me like it will clear the state in the `SSL` object if you see one of these things - which, if you then used it again, would initiate a new unencrypted handshake like you are seeing in the wireshark trace.

I did a quick test using openssl's s_server and s_client applications, with a blocking socket, and I did see an `SSL_ERROR_WANT_READ` occur on the client side when the server initiated a renegotiation. So this definitely can and does happen in practice.

**Reply by DWota** [reply]
@mattcaswell ,
I modified the code so that SSL_clear is not called even when an error occurs during SSL_write or SSL_read. However, on the server side it reports that renegotiation has succeeded, but afterward, even if the client sends data using SSL_write, it fails.

So I created a simple sample program that performs renegotiation initiated by the server. However, even with this code, after the server-side renegotiation succeeds, an SSL_write from the client still fails.

https://github.com/DWota/tcp-tls-sample/tree/develop/CER/SSLCertTest1

Do you have any idea which part might be causing this issue?
The console logs that are displayed are shown below.

// client
```
client certificate loaded
[Client] Sent: "Hello from client #1"
[Client] Received: "<html><body><pre>Hello from client #1</pre></body></html>

"
[Client] Sent: "Hello from client #2"
[Client] Received: "<html><body><pre>Hello from client #2</pre></body></html>

"
[Client] Sent: "Hello from client #3"
[Client] Received: "<html><body><pre>Hello from client #3</pre></body></html>

"
[Client] Sent: "Hello from client #4"
[Client] Received: "<html><body><pre>Hello from client #4</pre></body></html>

"
[Client] Sent: "Hello from client #5"
[Client] Received: "<html><body><pre>Hello from client #5</pre></body></html>

"
[Client] Sent: "Hello from client #6"
[Client] Received: "<html><body><pre>Hello from client #6</pre></body></html>

"
[Client] Sent: "Hello from client #7"
[Client] Received: "<html><body><pre>Hello from client #7</pre></body></html>

"
[Client] Sent: "Hello from client #8"
[Client] Received: "[SERVER] RENEGO-OK
"
[Client] Server renegotiation confirmed.
[Client] SSL_write error.
```

// Server
```
Certificate loaded
Listener opened
Accepted: Client 408
Client certificates:
Subject: /CN=Client
Issuer: /CN=Client
Client msg: "Hello from client #1"
Client msg: "Hello from client #2"
Client msg: "Hello from client #3"
Client msg: "Hello from client #4"
Client msg: "Hello from client #5"
Client msg: "Hello from client #6"
Client msg: "Hello from client #7"
[Server] Trigger renegotiation...
[Server] Renegotiation completed successfully (TLS1.2)
Client msg: "Hello from client #8"
```

**Reply by DWota** [reply]
Hi  @mattcaswell , just a quick follow‑up.

In the last code snippet I shared, on the client side I do not call SSL_clear().
Instead, the client continues calling SSL_write() / SSL_read(), and when
SSL_ERROR_WANT_READ or SSL_ERROR_WANT_WRITE is returned, it simply retries.

However, even with this logic, the SSL_write() on the client side fails
after the server‑initiated renegotiation has completed successfully.

What kinds of issues could cause SSL_write() to fail at this point on the client side?
Is there anything specific the client is expected to handle around the renegotiation boundary?

Thanks again for your help.
