### ISSUE TITLE
SSL_accept SSL_ERROR_WANT_READ

### ISSUE THREAD

**Issue by vadtam** [openssl/openssl#10279]
Windows. Non-blocking sockets, Select() method. OpenSSL 1.1.1d.

Server: The server code only. The server is at https://127.0.0.1:8887/
Client: There is no client code, I access the server using the Chrome browser.

The program works normal on the laptop in Chrome.
But on the PC, the very first call to `SSL_accept()` results in an infinite loop of `SSL_ERROR_WANT_READ` messages.

Then I try to call` SSL_read()` to eliminate the `SSL_ERROR_WANT_READ` error, it returns the "-1 bytes" value. I.e. the call to `SSL_read()` do not succeed either.

Can it be due to local proxy setup etc?

Question: could you write me the steps to go through to debug this issue?

**Comment by mattcaswell** [comment]
A first step might be to use wireshark to have a look at how far the handshake gets before it fails. An alternative is to call `SSL_set_msg_callback(con, SSL_trace)` where `con` is your `SSL` object instance. Note that this requires OpenSSL to be compiled with the `enable-ssl-trace` Configure option.

**Comment by vadtam** [comment]
The program accepts some connections, the program sends some messages. But then the program is locked at the `SSL_accept()` loop requesting `SSL_ERROR_WANT_READ`. Also, there is a strange non-socket error 183 ERROR_ALREADY_EXISTS after first SSL_accept().

The server debug info log:
```
2019-10-30 09:09:04 Server has been configured.
2019-10-30 09:09:04  ** Listening at select() ** 
2019-10-30 09:09:09  ** inside acceptConnection() ** 
2019-10-30 09:09:09 Server says: Client 127.0.0.1:53811 is connected.
2019-10-30 09:09:09 before SSL_accept no errors
2019-10-30 09:09:09  ** SOCKET_ERROR after SSL_accept: (ErrorCode 183)
2019-10-30 09:09:09  ** SOCKET_ERROR: Cannot create a file when that file already exists.
2019-10-30 09:09:09 SSL/TLS connection is encripted using TLS_AES_128_GCM_SHA256
2019-10-30 09:09:09 exited acceptConnection()
2019-10-30 09:09:09  ** Listening at select() ** 
2019-10-30 09:09:09  ** inside acceptConnection() ** 
2019-10-30 09:09:09 Server says: Client 127.0.0.1:53812 is connected.
2019-10-30 09:09:09 before SSL_accept no errors
2019-10-30 09:09:09  ** SOCKET_ERROR after SSL_accept: (ErrorCode 183)
2019-10-30 09:09:09  ** SOCKET_ERROR: Cannot create a file when that file already exists.
2019-10-30 09:09:09 SSL/TLS connection is encripted using TLS_AES_128_GCM_SHA256
2019-10-30 09:09:09 exited acceptConnection()
2019-10-30 09:09:09  ** inside receiveMessage() ** 
2019-10-30 09:09:09 exited receiveMessage()
2019-10-30 09:09:09  ** Listening at select() ** 
2019-10-30 09:09:09  ** inside acceptConnection() ** 
2019-10-30 09:09:09 Server says: Client 127.0.0.1:53813 is connected.
2019-10-30 09:09:09 -->HERE THERE IS A DEADLOCK AT SSL_ACCEPT)=
```
The wireshark debug log for port 8887:
```
TCP	56	53811 → 8887 [SYN] Seq=0 Win=65535 Len=0 MSS=65495 WS=256 SACK_PERM=1
TCP	56	8887 → 53811 [SYN, ACK] Seq=0 Ack=1 Win=65535 Len=0 MSS=65495 WS=256 SACK_PERM=1
TCP	44	53811 → 8887 [ACK] Seq=1 Ack=1 Win=2619648 Len=0
TCP	56	53812 → 8887 [SYN] Seq=0 Win=65535 Len=0 MSS=65495 WS=256 SACK_PERM=1
TCP	56	8887 → 53812 [SYN, ACK] Seq=0 Ack=1 Win=65535 Len=0 MSS=65495 WS=256 SACK_PERM=1
TCP	44	53812 → 8887 [ACK] Seq=1 Ack=1 Win=2619648 Len=0
TLSv1.3	561	Client Hello
TCP	44	8887 → 53811 [ACK] Seq=1 Ack=518 Win=2619648 Len=0
TLSv1.3	561	Client Hello
TCP	44	8887 → 53812 [ACK] Seq=1 Ack=518 Win=2619648 Len=0
TCP	56	53813 → 8887 [SYN] Seq=0 Win=65535 Len=0 MSS=65495 WS=256 SACK_PERM=1
TCP	56	8887 → 53813 [SYN, ACK] Seq=0 Ack=1 Win=65535 Len=0 MSS=65495 WS=256 SACK_PERM=1
TCP	44	53813 → 8887 [ACK] Seq=1 Ack=1 Win=2619648 Len=0
TLSv1.3	1686	Server Hello, Change Cipher Spec, Application Data, Application Data, Application Data, Application Data
TCP	44	53811 → 8887 [ACK] Seq=518 Ack=1643 Win=2618112 Len=0
TLSv1.3	108	Change Cipher Spec, Application Data
TCP	44	8887 → 53811 [ACK] Seq=1643 Ack=582 Win=2619648 Len=0
TLSv1.3	580	Application Data
TLSv1.3	267	Application Data
TCP	44	53811 → 8887 [ACK] Seq=1118 Ack=1866 Win=2617856 Len=0
TCP	44	8887 → 53811 [ACK] Seq=1866 Ack=1118 Win=2619136 Len=0
TLSv1.3	267	Application Data
TCP	44	53811 → 8887 [ACK] Seq=1118 Ack=2089 Win=2617600 Len=0
TLSv1.3	1686	Server Hello, Change Cipher Spec, Application Data, Application Data, Application Data, Application Data
TCP	44	53812 → 8887 [ACK] Seq=518 Ack=1643 Win=2618112 Len=0
TLSv1.3	108	Change Cipher Spec, Application Data
TCP	44	8887 → 53812 [ACK] Seq=1643 Ack=582 Win=2619648 Len=0
TLSv1.3	267	Application Data
TCP	44	53812 → 8887 [ACK] Seq=582 Ack=1866 Win=2617856 Len=0
TLSv1.3	267	Application Data
TCP	44	53812 → 8887 [ACK] Seq=582 Ack=2089 Win=2617600 Len=0
-->HERE THERE IS A DEADLOCK AT SSL_ACCEPT()
```

**Comment by mattcaswell** [comment]
Hmmm...nothing obviously wrong there. Can you post the actual pcap file from wireshark?

**Comment by mattcaswell** [comment]
If you could post a code sample of what your SSL_accept loop looks like it might help.

**Comment by vadtam** [comment]
```
        int32 SSLacceptReturnCode;
        while(true)
        {
            SSLacceptReturnCode = SSL_accept(pSocketState->ssl);
            if(SSLacceptReturnCode == 0)
            {
                // FATAL ERROR
                InvalidCodePath;
            }
            else if(SSLacceptReturnCode == 1)
            {
                // SUCCESS
                break;
            }
            else if(SSLacceptReturnCode < 0)
            {
                int32 SSLgetErrorCode = SSL_get_error(pSocketState->ssl, SSLacceptReturnCode);
                if(SSLgetErrorCode == SSL_ERROR_WANT_READ)
                {
                    /* Wait for data to be read */
                    continue;
                }
                else
                {
                    // FATAL ERROR
                    InvalidCodePath;
                }
            }
            else
            {
                InvalidCodePath;
            }
        }
```

Attached is the Wireshark PCAP file for this bug.
[pcap.zip](https://github.com/openssl/openssl/files/3788359/pcap.zip)

**Comment by mattcaswell** [comment]
What kind of BIOs are you using in this code? Are you doing any kind of buffering anywhere that might cause messages to not be delivered to libssl?

**Comment by vadtam** [comment]
> What kind of BIOs are you using in this code? Are you doing any kind of buffering anywhere that might cause messages to not be delivered to libssl?

I don't use any BIOs. I think they are redundant since newer versions of OpenSSL. There is no message buffering. The code is simple.

**Comment by kroeckx** [comment]
There is always a BIO involved. Do you mean you used SSL_set_fd?

**Comment by vadtam** [comment]
> There is always a BIO involved. Do you mean you used SSL_set_fd?

Yes, I mean there is no explicit BIO structs. I used `SSL_set_fd()`. I will provide you with the `SSL_state_string_long()` strings tomorrow morning.

**Comment by vadtam** [comment]
The `SSL_state_string_long(pSocketState->ssl)` calls before and after the SSL_accept() call show the following output.
```
2019-10-31 08:03:16 Server has been configured.
2019-10-31 08:03:16  ** Listening at select() ** 
2019-10-31 08:03:20  ** inside acceptConnection() ** 
    2019-10-31 08:03:20 Server says: Client 127.0.0.1:54657 is connected.
    2019-10-31 08:03:21 before SSL_accept loop()

        2019-10-31 08:03:21 before SSL_accept() call
            2019-10-31 08:03:21 before SSL initialization
        2019-10-31 08:03:21 after SSL_accept() call
            2019-10-31 08:03:21 TLSv1.3 early data

        2019-10-31 08:03:21 before SSL_accept() call
            2019-10-31 08:03:21 TLSv1.3 early data
        2019-10-31 08:03:21 after SSL_accept() call
            2019-10-31 08:03:21 SSL negotiation finished successfully

    2019-10-31 08:03:21 after SSL_accept() loop
    2019-10-31 08:03:21  ** SOCKET_ERROR at Control_1_5: (ErrorCode 183)
    2019-10-31 08:03:21  ** SOCKET_ERROR: Cannot create a file when that file already exists.
2019-10-31 08:03:21 exited acceptConnection()

2019-10-31 08:03:21  ** Listening at select() ** 
2019-10-31 08:03:21  ** inside acceptConnection() ** 
    2019-10-31 08:03:21 Server says: Client 127.0.0.1:54658 is connected.
    2019-10-31 08:03:21 before SSL_accept loop()

        2019-10-31 08:03:21 before SSL_accept() call
            2019-10-31 08:03:21 before SSL initialization
        2019-10-31 08:03:21 after SSL_accept() call
            2019-10-31 08:03:21 TLSv1.3 early data

        2019-10-31 08:03:21 before SSL_accept() call
            2019-10-31 08:03:21 TLSv1.3 early data
        2019-10-31 08:03:21 after SSL_accept() call
            2019-10-31 08:03:21 SSL negotiation finished successfully

    2019-10-31 08:03:21 after SSL_accept() loop
    2019-10-31 08:03:21  ** SOCKET_ERROR at Control_1_5: (ErrorCode 183)
    2019-10-31 08:03:21  ** SOCKET_ERROR: Cannot create a file when that file already exists.
2019-10-31 08:03:21 exited acceptConnection()

2019-10-31 08:03:21  ** inside receiveMessage() ** 
    2019-10-31 08:03:21  ** SOCKET_ERROR at SocketMethodNameNotSet: (ErrorCode 183)
    2019-10-31 08:03:21  ** SOCKET_ERROR: Cannot create a file when that file already exists.
2019-10-31 08:03:21 exited receiveMessage()

2019-10-31 08:03:21  ** Listening at select() ** 
2019-10-31 08:03:21  ** inside acceptConnection() ** 
    2019-10-31 08:03:21 Server says: Client 127.0.0.1:54659 is connected.
    2019-10-31 08:03:21 before SSL_accept loop()
        2019-10-31 08:03:21 before SSL_accept() call
            2019-10-31 08:03:21 before SSL initialization
        2019-10-31 08:03:21 after SSL_accept() call
            2019-10-31 08:03:21 before SSL initialization
        2019-10-31 08:03:21 before SSL_accept() call
            2019-10-31 08:03:21 before SSL initialization
        2019-10-31 08:03:21 after SSL_accept() call
            2019-10-31 08:03:21 before SSL initialization
        2019-10-31 08:03:21 before SSL_accept() call
            2019-10-31 08:03:21 before SSL initialization
        2019-10-31 08:03:21 after SSL_accept() call
            2019-10-31 08:03:21 before SSL initialization
        2019-10-31 08:03:21 before SSL_accept() call
            2019-10-31 08:03:21 before SSL initialization
        2019-10-31 08:03:21 after SSL_accept() call
            2019-10-31 08:03:21 before SSL initialization
        2019-10-31 08:03:21 before SSL_accept() call
    ... the same pattern is repeated.. "before SSL initialization ...
    - // - 
```

**Comment by vadtam** [comment]
> Something seems to go wrong here! We expect SSL_accept to return successfully at this point. What is the actual SSL_accept return value at this point?

If you refer to the SSL_accept() loop, the actual loop break does happen after the "SSL negotiation finished successfully" line. If SSL_accept returns 1, then break.
```
        while(true)
        {
            OutputDebugStringA("before SSL_accept() call");
            OutputDebugStringA((char *)SSL_state_string_long(pSocketState->ssl));
            SSLacceptReturnCode = SSL_accept(pSocketState->ssl); // SSL Handshake
            OutputDebugStringA("after SSL_accept() call");
            OutputDebugStringA((char *)SSL_state_string_long(pSocketState->ssl));
            if(SSLacceptReturnCode == 0)
            {
                InvalidCodePath;
            }
            else if(SSLacceptReturnCode == 1)
            {
                break;
            }
            else if(SSLacceptReturnCode < 0)
            {
                int32 SSLgetErrorCode = SSL_get_error(pSocketState->ssl, SSLacceptReturnCode);
                if(SSLgetErrorCode == SSL_ERROR_WANT_READ)
                {
                    /* Wait for data to be read */
                    continue;
                }
                else
                {
                    InvalidCodePath;
                }
            }
            else
            {
                InvalidCodePath;
            }
        }
```

**Comment by mattcaswell** [comment]
> If you refer to the SSL_accept() loop, the actual loop break does happen after the "SSL negotiation finished successfully" line. If SSL_accept returns 1, then break.

Right - I'm asking you to print the actual SSL_accept return value.

**Comment by vadtam** [comment]
> Right - I'm asking you to print the actual SSL_accept return value.

SSL_accept() keeps returning "-1".

**Comment by mattcaswell** [comment]
Hmm. That's very strange. I can't think of a reason at the moment why it would do that. Are you able to run this in a debugger? You will need to compile openssl with debugging symbols available (--debug option to Configure). In the call to accept which results in the move to the "SSL negotiation finished successfully" line, I expect to end up in the "tls_finish_handshake" function in ssl/statem/statem_lib.c. Set a breakpoint in there and make sure the function completes successfully. From there it should be a more-or-less straight line return up the call stack back to the SSL_accept() call in your application - which is supposed to result in a 1 return. We're trying to figure out at what point in deviates from that straight line return and you get something other than 1.

**Comment by mattiasbarthel** [comment]
I seem to be getting this issue in our environment as well. Its just busy wait looping between SSL_accept() and SSL_ERROR_WANT_READ. 
Is there a remedy for this? Or should I add a work around that limits the number of attempts simply?

**Comment by nvkhoi112358** [comment]
Similar thing happen to `BIO_read` and `BIO_should_retry`.

When client close connection at right time (after the handshaking complete but before sending request),
```
curl -v -L -O -k --tlsv1.2 https://server-ip/content
...
} [5 bytes data]
* TLSv1.2 (OUT), TLS handshake, Client hello (1):
} [207 bytes data]
  0     0    0     0    0     0      0      0 --:--:--  0:00:04 --:--:--     0* TLSv1.2 (IN), TLS handshake, Server hello (2):
{ [93 bytes data]
* TLSv1.2 (IN), TLS handshake, Certificate (11):
{ [646 bytes data]
* TLSv1.2 (IN), TLS handshake, Server key exchange (12):
{ [172 bytes data]
* TLSv1.2 (IN), TLS handshake, Server finished (14):
{ [4 bytes data]
* TLSv1.2 (OUT), TLS handshake, Client key exchange (16):
} [37 bytes data]
* TLSv1.2 (OUT), TLS change cipher, Client hello (1):
} [1 bytes data]
* TLSv1.2 (OUT), TLS handshake, Finished (20):
} [16 bytes data]
  0     0    0     0    0     0      0      0 --:--:--  0:00:05 --:--:--     0^C

``` 
Despite the connection is closed, `BIO_read` is -1 but `BIO_should_retry` and `BIO_should_read` return true.
`BIO_should_retry` just checking the flag of BIO that translating from `SSL_ERROR_WANT_READ`.

OpenSSL re-compile 1.1.0f of centos 7 and system lib 1.1.0j of debian 9, re-compile 1.1.1f on debian.

**Comment by ROTARTSI82** [comment]
Hmm. I'm having a very similar issue with DTLS. I'm just beginning to learn OpenSSL. I'm basing my code off of https://github.com/nplab/DTLS-Examples/blob/master/src/dtls_udp_echo.c 

My code (sorry if it's bad):
https://github.com/RotartsiORG/StoneMason/blob/master/src/stms/net/dtls.cpp
https://github.com/RotartsiORG/StoneMason/blob/master/include/stms/net/dtls.hpp

I would create a new `DTLSServer`, call `start()`, and then call `tick()` in a loop. 
I would then try to connect with `openssl s_client -comp -dtls1_2 -timeout -async -nbio -debug -msg -verify 5 -connect *myip*:3000 -CAfile ca-pub-cert.pem -cert cli-pub-cert.pem -key cli-priv-key.pem`, but in the server I would see:
```
[17:00:06.143] [  info  ] [10427|10427] [DTLSServer|dtls.cpp:192]: Creating new DTLS server to be hosted on *myip*:3000
[17:00:06.144] [  info  ] [10427|10427] [tryAddr|dtls.cpp:438]: Candidate 0: IPv4 *myip*:3000
[17:00:06.144] [  info  ] [10427|10427] [tryAddr|dtls.cpp:480]: Candidate 0 is viable and active. However, it is not necessarily preferred.
[17:00:06.144] [  info  ] [10427|10427] [start|dtls.cpp:225]: Using Candidate 0 because it is IPv4
[17:00:07.028] [  info  ] [10427|10427] [tick|dtls.cpp:307]: New client at *myip*:38690 is trying to connect.
[17:00:07.029] [warning ] [10427|10427] [tick|dtls.cpp:360]: Fatal DTLS Handshake error! Refusing to connect.
[17:00:07.029] [warning ] [10427|10427] [handleSslGetErr|dtls.cpp:524]: Unable to complete OpenSSL call: Want Read. Please retry. (Auto Retry is on!)
```
`SSL_accept` is returning `SSL_ERROR_WANT_READ`. At this point, I drop the connection because the docs say that this is a fatal error.
Hope this helps.

**Comment by ROTARTSI82** [comment]
Interesting. If i set the client socket to blocking, the error goes away. The server socket could still be non-blocking. (I have SSL_MODE_ASYNC on too)

**Comment by mattcaswell** [comment]
> SSL_accept is returning SSL_ERROR_WANT_READ. At this point, I drop the connection because the docs say that this is a fatal error.

Where do they say this is a fatal error? The man page for SSL_ERROR_WANT_READ says:

````
The operation did not complete and can be retried later.

B<SSL_ERROR_WANT_READ> is returned when the last operation was a read
operation from a non-blocking B<BIO>.
It means that not enough data was available at this time to complete the
operation.
If at a later time the underlying B<BIO> has data available for reading the same
function can be called again.
````

**Comment by ROTARTSI82** [comment]
Man pages for `SSL_accept`, under the return values section:
```
<0

    The TLS/SSL handshake was not successful because a fatal error occurred either at the protocol level or a connection failure occurred. The shutdown was not clean. It can also occur if action is needed to continue the operation for non-blocking BIOs. Call SSL_get_error() with the return value ret to find out the reason.
```

**Comment by mattcaswell** [comment]
These are two separate things.
Reason 1)
The TLS/SSL handshake was not successful because a fatal error occurred
either at the protocol level or a connection failure occurred.
The shutdown was not clean.
Reason 2)
It can also occur if
action is needed to continue the operation for non-blocking BIOs.
Call SSL_get_error() with the return value ret to find out the reason.

So you are experiencing reason 2. This is not a fatal error and can be retried.

**Comment by kroeckx** [comment]
The manpage has been changed a long time ago to say:
The read operation was not successful, because either the
connection was closed, an error occurred or action must be taken
by the calling process.  Call SSL_get_error(3) with the return
value ret to find out the reason.

**Comment by mattcaswell** [comment]
> The manpage has been changed a long time ago to say

That's the SSL_read man page. The SSL_accept man page says something different. It probably should say the same thing.

**Comment by ROTARTSI82** [comment]
Hmm. I've modified my code to call `SSL_read` or `SSL_write` if `WANT_READ` or `WANT_WRITE` are returned. It looks like everything (including `SSL_accept` and `SSL_read`) is just timing out instantly with non-blocking client sockets. If I just call `SSL_accept` in a loop, it works eventually.

**Comment by ROTARTSI82** [comment]
Sorry It seems I have misunderstood the timeout mechanism in OpenSSL. I thought that it times out when a message from the client hasn't been recieved in a certain amount of time.

**Comment by kaduk** [comment]
The `WANT_READ` and `WANT_WRITE` states indicate that you need to select(), poll(), or otherwise wait for the underlying socket to be readable (respectively, writable).  Just calling the SSL functions in a loop is not helpful.

**Comment by mattiasbarthel** [comment]
Ok, maybe I wasnt clear enough, and now lots of time have passed since my last post
But we are calling SSL_Accept again as a result of a read event being triggered from libevent:

`static void handle_read_event(int socket, short event, void* arg)
{
    http_connection_t c = (http_connection_t)arg;
    int result;

    if (event == EV_TIMEOUT)
    {
        if (c->rendering)
        {
            http_connection_register_read_event(c);
            return;
        }
        http_connection_close(c);
        atomic_inc(&counters.timeout);
        return;
    }

    if (c->ssl && !c->ssl_handshake_complete)
    {
        http_ssl_setup_handshake(c);`

`void http_ssl_setup_handshake(http_connection_t connection)
{
    if (connection->ssl_retry_start == 0)
    {
        time(&connection->ssl_retry_start);
    }
    // Do the SSL handshake
    int n = SSL_accept(connection->ssl);
    const int success = 1;`

At the moment we are remedying the issue by retrying for 2s, but its not a nice work around and it takes unecessary cpu-cycles.

**Comment by kaduk** [comment]
@mattiasbarthel I suggest filing a new issue with your scenario and a complete writeup.
The post at https://github.com/openssl/openssl/issues/10279#issuecomment-608420467 suggests that you are calling `SSL_accept()` when libevent reports "read possible" but keep getting back `SSL_ERROR_WANT_READ` from `SSL_accept()` (which would indeed be surprising), but it's hard to be 100% certain.  If you can get a packet capture correlated with the code tracethrough that would be even better.

**Comment by mattiasbarthel** [comment]
Hi @kaduk and thanks for your response. Packet capture will be quite difficult since it happens mostly under high load. 
But I guess we can filter out TCP ports in the trace.
Regarding code tracethrough, do you then refer to turning the openssl library to a debug library? (If so how is it done?)
Or traceing our own application?

**Comment by kaduk** [comment]
> Hi @kaduk and thanks for your response. Packet capture will be quite difficult since it happens mostly under high load.
> But I guess we can filter out TCP ports in the trace.
> Regarding code tracethrough, do you then refer to turning the openssl library to a debug library? (If so how is it done?)
> Or traceing our own application?

Understood that a packet capture is challenging and may not happen.
By "code tracethrough" I just meant something similar to what you've already done, noting the relevant codepaths in your application where it interacts with libevent and (e.g.) SSL_accept() -- what values are returned when, and the like.  There is a trace option for openssl (interestingly, for this I think it would just be `enable-trace` to configure, not `enable-ssl-trace` which is for `s_client`/`s_server`), but I think it would be more detail than is needed here.

**Comment by nvkhoi112358** [comment]
> @mattiasbarthel I suggest filing a new issue with your scenario and a complete writeup.
> The post at [#10279 (comment)](https://github.com/openssl/openssl/issues/10279#issuecomment-608420467) suggests that you are calling `SSL_accept()` when libevent reports "read possible" but keep getting back `SSL_ERROR_WANT_READ` from `SSL_accept()` (which would indeed be surprising), but it's hard to be 100% certain. If you can get a packet capture correlated with the code tracethrough that would be even better.

I manage to reproduce the issue when continuously drop the connection from client right after the ACK of TLS client hello is received
![https-accept-drop-client-hello](https://user-images.githubusercontent.com/45621633/107140177-eb3fe500-6952-11eb-985b-90d9190527cf.png)
Log at our server after retry 2s (2 is the WANT_READ, you know better than me)
```
http_ssl_setup_handshake: unexpected reason: 2, error message: Transport endpoint is not connected (dropping connection)
```

Might be this relevant https://github.com/openssl/openssl/issues/11574#issuecomment-698061774

**Comment by kaduk** [comment]
@nvkhoi112358 it may be better to open a new github issue for your issue, as there is no guarantee that the underlying problem is the same as this one.
In particular, your packet capture seems to show the client starting the TCP 3-way handshake, sending a ClientHello, and then gracefully closing the TCP connection once the TCP segment with the ClientHello got acked.  That's pretty strange, and seems to indicate an issue in the client application rather than in openssl.
