### ISSUE TITLE
error:04091068:rsa routines:int_rsa_verify:bad signature

### ISSUE THREAD

**Issue by vinayashreeks** [openssl/openssl#8010]
Hi everyone,

I am using openssl-1.0.2p in WEC7 client device and using openssl-1.1.1 in Ubuntu 18.10 server machine.Server is running hostapd.When client is trying to connect to server by EAPTLS method using TLSv1.2 ,while certificate verify server is giving the below error.
(Seeing same issue whith Windows Embedded 8 64 bit client)

"SSL: SSL3 alert: write (local SSL3 detected an error):fatal:decrypt error"
"OpenSSL: openssl_handshake - SSL_connect error:04091068:rsa routines:int_rsa_verify:bad signature"

When i traced int_rsa_verify API in server ,i found that decrypted data is not same as encoded data ,that is the reason for this error.

But the fact is with same certificates and same server and client setup ,client got connected to server with TLSv1.0 .
When TLSv1_client_method() is replaced by TLSv1_2_client_method() ,i am facing this issue.
Client side i am not getting any errors.Anything else needs to be modified to upgrade to TLSV1_2 version???

Can anyone help me in fixing or debugging this issue???Got struck in this ,any help will be greatly needed.
Thanks in advance

@alex @JackDanger @thiagoarrais  @shlomif @openssl @openssl-machine @mattcaswell

**Comment by BaeSunjin** [comment]
I have a same issue on android arm64

I'm using openssl-1.0.2g 
test client: Window 64bit, Android armv6, Android arm64

Work fin at Window 64bit, Android armv6  but Arndroid arm64 was not

this my error log
`error:04091068:rsa routines:INT_RSA_VERIFY:bad signature`

attch my tshark log
```
Success simple log (at window 64)
TLSv1.2    Client Hello
TSLv1.2    Server Hello
TSLv1.2    Certificate [TC{ segment of a reassembled PDU]
TSLv1.2    Server Key exchange, Server Hello Done
TSLv1.2    Client Key Exchange , CahngeCipher spec, Encrpyted Handshake Message
TSLv1.2    New Setssion Ticket, Change Cipher Spec, Encryped Handshake Message

Failed (at Android arm64)
 1 0.000000000 10.10.100.164 → 10.10.0.112  TCP 66 50467 → 8022 [RST, ACK] Seq=1 Ack=1 Win=730 Len=0 TSval=6124309 TSecr=4237928
    2 0.000100618 10.10.100.164 → 10.10.0.112  TCP 74 50708 → 8022 [SYN] Seq=0 Win=65535 Len=0 MSS=1460 SACK_PERM=1 TSval=6124309 TSecr=0 WS=128
    3 0.000116401  10.10.0.112 → 10.10.100.164 TCP 74 8022 → 50708 [SYN, ACK] Seq=0 Ack=1 Win=28960 Len=0 MSS=1460 SACK_PERM=1 TSval=4355577 TSecr=6124309 WS=128
    4 0.003388439 10.10.100.164 → 10.10.0.112  TCP 66 50708 → 8022 [ACK] Seq=1 Ack=1 Win=87680 Len=0 TSval=6124310 TSecr=4355577
    5 0.005494923 10.10.100.164 → 10.10.0.112  TLSv1 373 Client Hello
    6 0.005511434  10.10.0.112 → 10.10.100.164 TCP 66 8022 → 50708 [ACK] Seq=1 Ack=308 Win=30080 Len=0 TSval=4355579 TSecr=6124310
    7 0.006953089  10.10.0.112 → 10.10.100.164 TLSv1.2 3063 Server Hello, Certificate, Server Key Exchange, Server Hello Done
    8 0.011572838 10.10.100.164 → 10.10.0.112  TCP 66 50708 → 8022 [ACK] Seq=308 Ack=1449 Win=90496 Len=0 TSval=6124310 TSecr=4355579
    9 0.011651070 10.10.100.164 → 10.10.0.112  TCP 66 50708 → 8022 [ACK] Seq=308 Ack=2897 Win=93440 Len=0 TSval=6124310 TSecr=4355579
   10 0.011734053 10.10.100.164 → 10.10.0.112  TCP 66 50708 → 8022 [ACK] Seq=308 Ack=2998 Win=93440 Len=0 TSval=6124310 TSecr=4355579
   11 0.013933212 10.10.100.164 → 10.10.0.112  TLSv1.2 73 Alert (Level: Fatal, Description: Decrypt Error)
   12 0.014175981  10.10.0.112 → 10.10.100.164 TCP 66 8022 → 50708 [FIN, ACK] Seq=2998 Ack=315 Win=30080 Len=0 TSval=4355581 TSecr=6124311
   13 0.053519424 10.10.100.164 → 10.10.0.112  TCP 66 50708 → 8022 [ACK] Seq=315 Ack=2999 Win=93440 Len=0 TSval=6124315 TSecr=4355581
```

thanks

**Comment by astrozhou** [comment]
Hi @vinayashreeks , have any solution here? I have a same issue on android arm64, using 1.1.1c

**Comment by mattcaswell** [comment]
This question seems stale with no recent activity. Marked as "unresolved" and scheduling for later closure.

**Comment by vejo** [comment]
We had a similar problem (at least the same error message) connecting a Windows client to MS Azure.
The client software is using node.js, and the error message seems to be originated in the openssl crypto layer, which is compiled into node.exe.

In our case the error occurs on client side when verifying the server signature.
At this time SHA256 hashing is required, and openssl passes the call directly to the processor.
But some Intel Goldmont processors do not have this feature on board, and openssl is not aware of that fact.
The result is a verification mismatch.
The original discussion about the issue can be found at https://github.com/nodejs/node/issues/12691.

In our case it helps, if hardware SHA256 is disabled by setting an environment variable:
SET OPENSSL_ia32cap=~0x1000000000000000:~0

Everything said before is not scientifically proved.
Just in our case it works.

**Comment by naushadck** [comment]
I am getting the following error. 

12736:error:04091068:rsa routines:INT_RSA_VERIFY:bad signature:.\crypto\rsa\rsa_sign.c:278:
12736:error:1408D07B:SSL routines:ssl3_get_key_exchange:bad signature:.\ssl\s3_clnt.c:2038:

How to resolve the bad_signature issue.
